author_id,created_at,id,lang,public_metrics_like_count,public_metrics_quote_count,public_metrics_reply_count,public_metrics_retweet_count,quoted_id,replied_to_id,text
1300305656805818368,2021-09-06 03:16:32+00:00,1434717123155271680,en,3,0,3,1,,,"This person is butthurt because I wanted to defend #PicoCass shippers. Like I'm sorry that I have a open mind, and I'm so fuckin' sorry that I give a damn about people. And that I want people to be happy and not be harassed! https://t.co/bjxLplUQ60 #PicosSchool #PicoSchool https://t.co/dC00e8WYfB"
3037030544,2021-09-05 23:40:53+00:00,1434662850681782275,en,0,0,0,0,1.4341211138318868e+18,,What an idiot. I’m so sorry that poor lady was harassed like that https://t.co/dp3b3xepqw
964623304190443520,2021-09-05 20:19:03+00:00,1434612061514846208,en,0,0,1,1,1.4346002569105408e+18,,"This from the great feminist. Not a word about the women that Saini allegedly harassed, but Trudeau will REFLECT. Trudeau is sorry that he lost a candidate, and he doesn't give a rats ass about the women. I wonder if Canadian women will notice. https://t.co/OM59yNkruS"
462320975,2021-09-05 20:04:17+00:00,1434608343604207616,en,0,0,0,0,1.4345891321861325e+18,,"I'm sorry, WWE there was a time they all harassed me. https://t.co/Djkxs8n6ui"
1394098839854923788,2021-09-05 01:02:13+00:00,1434320933146275842,en,0,1,0,0,,,"Durrrrrrrrrrrrrrrrr you just made a video. Durrrrrrrrrrrrrrrrrrrrrrrrrrrrrrrrrr.... Norma, RIP, I'm sorry you had to be harassed by these people over a mere 3,000.00. https://t.co/FgXMqwNgbv"
1431224467640946693,2021-09-04 23:24:45+00:00,1434296406785904641,en,0,0,0,0,1.433930948366807e+18,,"I am so sorry for your mother these COVID-19 #Deniers are lucky I am not #PM I would #Deport anybody regardless of nationality who insulted and harassed #NHS nurses the whole nation appreciates the work your mother has done pity the #Government 
does not https://t.co/5H9qJWUw1X"
1260973233752494080,2021-09-02 13:37:10+00:00,1433423758681849857,en,1,0,0,0,8.983183337827082e+17,,why is this bitch not banned yet holy hell. to everyone affected or harassed by her i am so so sorry none of you deserved that https://t.co/nZrLqFPvzY
1215244768915197952,2021-09-01 15:45:18+00:00,1433093614805082112,en,36,2,4,1,1.4323794822418637e+18,,"You’ve officially lost all support from me. I’m sorry you’ve been harassed by people, but you

1) Targeted a Rose cosplayer
2) Target people who have pronouns in their bio. What’s the big deal wtf it’s not an argument 
3) Target people who have the slightest diff opinion than you https://t.co/Ay0h159Hcl"
785936359517200385,2021-09-01 15:18:32+00:00,1433086880271187972,en,0,0,0,0,,,"I was so excited and couldn't attend at the last minute. I couldn't believe that idiots actually sexually harassed you for your kindness and generosity! No, sorry. Unfortunately, not only could I, but in our reality, it makes perfect disgusting sense. ""Follow the leader."" https://t.co/CQt3LnMXYS"
744916807346159616,2021-08-30 23:02:49+00:00,1432478944532500481,en,2,0,1,4,1.4185430227158344e+18,1.4323169718199337e+18,"@KarlOyekan Same thing happened to me some weeks ago, perpetrated by those same criminals in uniform that harassed you. Sorry for the experience bro, I have a firsthand experience so I can relate to how traumatizing it is, I hope you get justice. #EndSARS 

https://t.co/ovPdCEeCFJ"
1354875687270821889,2021-08-30 15:32:17+00:00,1432365567428730880,en,2,0,1,0,1.4323416393732014e+18,,I'm so sorry to the mods and contributors that have been harassed. This is ridiculous. Let people enjoy creating and consuming fan content! https://t.co/yrSU9SNl4G
592006790,2021-08-30 00:23:43+00:00,1432136917454368769,en,0,0,0,0,,,"I’m sorry but this has gone way too far. If she wanted a solution, this would have been handled in the courts. Twitter people can’t do anything about this and now a black woman is getting harassed for trying to clear her name. This is Salem Witch trial shit. Y’all are too old. https://t.co/CIV03q97J8"
132310486,2021-08-29 11:45:45+00:00,1431946169131876352,en,1,0,0,0,1.430905196075311e+18,,"Many many of us are very appreciative of the way you have shared information and tried to ensure we non scientists have a good understanding of Covid and impact of some of the policy decisions in the last 18 months.
I’m sorry you are now getting harassed. Please keep up your work https://t.co/0zckP9c4qQ"
505309269,2021-08-29 11:26:29+00:00,1431941319820292096,en,0,0,0,0,1.431618865583194e+18,,"I am sorry this happened to Michelle. I saw the video she refers to &amp; I am sorry about that too. But at least police take politicians seriously when they complain about harassment. Police laugh at, blame &amp; intimidate the rest of us mobbed, harassed and assaulted for our politics. https://t.co/QMTuHVpz6O"
1407043629290463232,2021-08-28 20:11:21+00:00,1431711019043225603,en,13,0,2,2,1.431618865583194e+18,,I urge you to read this carefully. I do not agree with aggression or bullying and am sorry she is being harassed. I do not agree with her assessment that more legislation is needed for online activity. https://t.co/XJUzKRN6l5
35590068,2021-08-28 20:00:33+00:00,1431708302644293640,en,0,0,0,0,,,"This shit has to stop! like why be so hateful, This beautiful queen has done nothing  to deserve this shit !!! @dovaplz love I am truly sorry that you have to go through this. @Twitch please fix this issue, there are way to many people getting bullied, harassed, fix it plz!! https://t.co/M4Jc82xpNM"
708661314,2021-08-28 17:15:16+00:00,1431666705328078859,en,2,0,1,0,1.4312997728711516e+18,,"(Mockingly straining) Nerdbomb, Nerdbomb! Sorry, but I just like to mock Jimmy Nerdbomb for a good reason.

Still, Jared betrayed us all when he revealed that he's an incestuous pedophile when he harassed his 3-year-old nephew! Such a thing does not belong into this fandom. https://t.co/aoGVi53sx1"
733429965333520390,2021-08-28 15:23:23+00:00,1431638550735310848,en,0,0,0,0,1.431618865583194e+18,,So so sorry Michelle that you are harassed like this. Never in my 50 + yrs of voting have I seen such deplorable viciousness by people. We never saw this prior to 2015. Those who are bullying should be made accountable for their aggressive behaviours. Not acceptable ! https://t.co/aPg6iU6lFZ
827625860006084608,2021-08-27 22:46:56+00:00,1431387784284188673,en,693,9,9,138,1.4308864281589596e+18,,"Sex Ed should be taught in elementary school sorry 🤷🏽‍♀️ I got sexually harassed by my own peers elementary, middle, and high…and I’ve heard way worse shit happen to other kids. Sex Ed is essential to stopping unwanted harassment https://t.co/EaHW3nVzlY"
1188589968798539777,2021-08-27 13:09:27+00:00,1431242455714656256,en,32,0,10,0,1.4312130896434463e+18,,"You're absolutely right, I just get harassed for the lulz I guess. Sorry for trying to have a moment of peace within my own space. https://t.co/WwCiysmtGc"
3094263236,2021-08-27 02:39:01+00:00,1431083804341403650,en,1,0,0,0,1.4309779004889743e+18,,"Im sorry didn’t you dox me? What happened to “leading with kindness” or “being the calm down person?” But you also ignored me on your set so why am I surprised? Also, what has the hair and makeup committee done lately? I still get harassed on set for my hair DAILY. https://t.co/9A4TAcnRwH"
1181155933,2021-08-27 01:15:59+00:00,1431062908524384258,en,0,0,0,0,1.4309748382110228e+18,,I’m sorry but renaming McCree is not only stupid but does absolutely nothing for the people that were harassed by the real life McCree. https://t.co/2xxb2vePDu
737036962239021056,2021-08-25 16:08:56+00:00,1430562851261861892,en,0,0,0,0,1.4303391748848558e+18,,"""sorry I stalked and harassed you and someone you cared about. so anyways, what's up?"" bitch nO https://t.co/HxTZcNpSN8"
14534810,2021-08-25 03:45:48+00:00,1430375831742865414,en,22,0,0,1,1.4303487000653087e+18,,"There's people harassing other ""Shinos"" because of what Shinocchi did... WTF, Sally said she didn't tell her story for you to harass anyone.
I'm sorry for anyone who's being harassed. https://t.co/PQ9sROOQTF"
1056400858223656960,2021-08-24 07:23:38+00:00,1430068267071201280,en,4,0,1,0,1.4298555753582019e+18,,"I’m so sorry you had this awful experience. It’s taxing finding safe spaces over here for queer folk to simply exist without being harassed by these heterodactyls. 

Nonetheless, I applaud you for choosing to shine your light each and every day. It’s not easy being firece.
💚✨ https://t.co/JhMGkKLlM5"
1378857811208208386,2021-08-24 00:56:37+00:00,1429970871381237772,en,0,0,0,0,,,"How much proof do you want I'm still trying to put it all together I have been electronically harassed and stopped the last 4 days but I got plenty of it, 4 and 1/2 years worth. This is a new profile though, got to show me your credentials sorry but I don't trust nothing. https://t.co/li3ggylPE6"
1174820725636685824,2021-08-23 17:30:16+00:00,1429858540445917193,en,1,0,0,0,1.4298402005455462e+18,,Sorry it took so long for me to see this i muted it but I’m gonna add you to a gc with the ladies in that have been harassed by him but I need you to follow me back x https://t.co/Rut6VjNAN7
1386703748341317634,2021-08-23 05:22:04+00:00,1429675284090007555,en,12,0,0,0,1.4293254930278318e+18,,The amount of immaturity in this fandom is fucking embarrassing. I’m sorry for all VA who have gotten harassed. https://t.co/dAd6WxSMiD
101169657,2021-08-23 02:19:52+00:00,1429629432780648453,en,29,0,3,0,1.428434307119403e+18,,"In @trishapaytas ‘s recent video they claimed Keemstar apologized to SA victims, but he never actually said the words “I’m sorry”, especially not to the SA victims he slandered/harassed. https://t.co/g1ySfgGdBI"
790886673517248512,2021-08-22 16:30:51+00:00,1429481200196878337,en,3,0,1,0,1.429467565873668e+18,,"I'm sorry Lex :( I know exactly how you feel, when I solo Q ranked. I get belittled and judged, harassed &amp; sometimes they even throw because I'm a woman or put all the blame me. Exhausting. 😞 It sucks &amp; even muting them afterwards doesn't work because I'm hurt already. :/ https://t.co/4mQGLjU91I"
880891177385381888,2021-08-21 06:20:38+00:00,1428965246207545346,en,1,0,0,0,1.4285431541904916e+18,,"""I'm sorry Dave, I can't do that...
.
.
.
... because I've harassed people in Twitter and caught fire."" https://t.co/dt55sDjrfv"
1206918016652496897,2021-08-20 22:24:23+00:00,1428845394797203457,en,5,0,0,0,1.428824327114281e+18,,Unwarranted hate is unnecessary. I’m sorry you have to deal with this constantly. I like standing up for people who deserve to be stood up for. No one good deserves to be bullied and harassed regardless of gender color creed identity code etc unless that above mentioned is sick https://t.co/ACO9JHynYV
1226667458800414720,2021-08-20 13:56:27+00:00,1428717571008729094,en,18,3,5,7,1.4287143347046605e+18,,"i'm so sorry to make this ooc and a bit of discourse thingy

but i wonder if antis will call mhy whitewashing kya lol, his skin colour here looks exactly like all artist who got harassed because of antis ...call out https://t.co/73f6gmLDp0"
871050457,2021-08-20 05:02:11+00:00,1428583116512301056,en,1,0,0,0,1.4284984820257997e+18,,"I don’t feel one bit sorry for these turds! Never forget these same morons ridiculed &amp; harassed Trump, every minute of his 4 yrs in office for fake dossiers &amp; phone calls! Who I REALLY want to see destroyed is the Damn Kenyan, Jarrett, Rice, Silverback Brennan, Comey &amp; McCabe! https://t.co/aVzScyPgOx"
1323826004876529665,2021-08-20 04:36:00+00:00,1428576528338669570,en,1,0,0,0,1.4285101734972662e+18,,"It’s really sad to see streamers get harassed like this and the company they stream for doesn’t even care. No public statement, no nothing. I’m so sorry you’re going through this @RekItRaven :/ #StandWithRaven https://t.co/BcsKOeMFr1"
3422867829,2021-08-19 23:08:44+00:00,1428494166380711936,en,0,0,0,0,,,I’m sorry u have to go thru this shit. That is just fucking ridiculous like u don’t deserve to be harassed onna regular basis like wtf 🤬….. keep yuh head up https://t.co/AlZaFvT3mx
181019374,2021-08-19 04:24:32+00:00,1428211254884196353,en,0,0,0,0,1.4281495459266437e+18,,I'm sorry you were harassed for clout morgan https://t.co/rRnzs64bfa
1061334607256342528,2021-08-18 20:37:58+00:00,1428093839076691969,en,6,0,0,0,1.4280637507210568e+18,,"this nigga said, I sexually harassed her I admit, but yall shouldn't be ignorant and believe the victim, sorry and thank you. 
That's all I heard. https://t.co/XXJt1YEZmR"
1081635420713205762,2021-08-18 18:36:18+00:00,1428063218761670663,en,41,0,3,3,1.42805777006293e+18,,"Same. Planned on saying something as well once I got the chance, but Schiggys has fully captured my exact situation as well. I'm sorry to the person that was harassed by them, &amp; that I ever contributed to them gaining any kind of platform. I had not seen this behavior until now. https://t.co/CkP3M9yzHI"
1356594412218941444,2021-08-18 10:53:18+00:00,1427946703588581377,en,1,0,0,0,,,i'm sorry are we really going to glorify a man who verbally harassed a woman on TV? https://t.co/zbHDKbOKE2
37501003,2021-08-18 10:44:35+00:00,1427944507010473986,en,140,1,3,11,1.4278749919079342e+18,,"Sorry people harassed you for having me on, I bet I can guess who! Good on you for not giving into them https://t.co/ZUzmtWFlqW"
1022074542968201216,2021-08-18 03:20:42+00:00,1427832801450135558,en,100,2,7,10,1.3441651733141545e+18,,"👇🏿 the below tweet is from 2020
I wasn’t wrong back thn, personally experienced how publicly they harassed me with taking pictures and making my videos when I was visiting some mall in Lahore.
This is their reality!
I am sorry #Ayesha https://t.co/kJVYjYQejQ"
1197392851283218432,2021-08-17 22:39:21+00:00,1427761999719501825,en,0,0,0,0,1.4277589719647068e+18,,@fabianqos's account is temporarily unavailable because it violates the Twitter Media Policy. Learn more.
965701782600142850,2021-08-17 04:25:09+00:00,1427486635348971520,en,15,1,3,6,1.4272587236265902e+18,,We’ve all made Ryan quite a controversial figure today on Twitter and IG but I’d like to put a shout out to the elderly woman who he harassed. She was the victim in all of this. And I am really sorry that no one in that car got up to defend you. People on Twitter did. https://t.co/9r1jZw2l97
799242417073487872,2021-08-16 09:01:19+00:00,1427193744940576769,en,2,0,1,0,1.4269494802769756e+18,,"I’m pretty confused about what happened but a lot of people are upset. I’m sorry for implying anyone in fandom harassed Kim - it’s truly not what I meant, even though I did see angry tweets about her from fandom people. https://t.co/U8QXJYwO9p"
1373391648537841666,2021-08-15 01:53:06+00:00,1426723592771887105,en,3,0,0,1,1.426548675673723e+18,,It’s giving yt twinks for sure. I’m sorry you were harassed like that! https://t.co/0RVKuwzLaD
3016141874,2021-08-14 23:45:36+00:00,1426691507101134849,en,0,0,0,0,1.4264023424512573e+18,,This is not the first medical professional that I have heard that has been harassed while tirelessly doing their job trying to save your sorry ass all because you refused to mask and get the vaccination. https://t.co/MxCOGMsR6L
1361462616019898370,2021-08-14 02:42:14+00:00,1426373571983646721,en,4,0,1,1,1.426368625137668e+18,,This is actually so toxic and disgusting and I hate seeing so many girls essentially being harassed for being a girl who plays video games. It breaks my heart and it infuriates me so much @kiisumii I'm so sorry you had to deal with these childish assholes. https://t.co/3sYUIbEioR
1273741913485643787,2021-08-14 01:26:53+00:00,1426354607442235397,en,17,0,1,2,1.426349892679598e+18,,"I hope this isn't true. You talk about getting stalked and harassed, but I guess it's only bad when it's happening to you?

Let. It. Go. 

I am so sorry I follow people YOU don't like. https://t.co/GPE6R4yCQR"
829486784505663489,2021-08-14 00:48:43+00:00,1426345001576013825,en,3,0,0,0,1.4256167225354035e+18,,"And to the man who harassed me to smile for him the other week, I might just be a pharmacy tech but my job can be hard I’m sorry if I’m not always miss sunshine but please stop harassing women in any profession he became so aggressive I ended up smiling (and sweating) out of fear https://t.co/e8pWMOuHQ2"
1403185241628499970,2021-08-13 01:31:01+00:00,1425993260032462852,en,21,0,0,3,1.425992992494588e+18,,"honest to god some of you need to grow up and stop harassing people for not liking our girlfriend design. i am genuinely so, so sorry to the people harassed during all of this, and i hope, for those people, that they get well soon. genuinely. none of this should’ve happened https://t.co/mgaR0NwsL0"
962079477466615809,2021-08-13 01:28:04+00:00,1425992518907437063,en,8,0,1,0,1.425991665680937e+18,,i led to this ? with a censored name ? get bent. im sorry they were harassed but i literally went out of my way to censor their names on my og tweet. ppl who decided to witch hunt and i cant control what others do https://t.co/IvXiDYyEtU
1072861428233789440,2021-08-12 14:26:56+00:00,1425826137066848256,en,1,0,0,0,1.4256230675988808e+18,,"I continue to be disgusted by the decisions of this convention. How dare you compare physical assault to “feeling harassed” and why am I only seeing you say sorry about that? You should be apologizing for letting a known, registered sex offender into a “family friendly” space. https://t.co/OntrmUbEAz"
792760713651511297,2021-08-12 14:01:00+00:00,1425819613091090440,en,62,0,3,3,1.4258186192677233e+18,,I can't accurately read emotions from voice tone alone now. That's why I never picked up I was being harassed and gaslit for 8 months until another neurodivergent coworker talked with me about it. I'm sorry I'm not the right neurodivergent person to agree with your stupid point https://t.co/t6HXJhTOFe
831602788278878210,2021-08-12 13:51:14+00:00,1425817151697420288,en,7,0,1,3,1.4256230675988808e+18,,"I really don't want to QRT dunk but ""sorry to hear that people felt harassed or worse""? Are you fucking kidding me? Someone got sexually assaulted and that's your response?

You were warned prior that a predator was planning to go and you did nothing. Non-apologies don't cut it. https://t.co/j0FoAkQppZ"
904808994656710657,2021-08-12 12:59:51+00:00,1425804222415650819,en,0,0,1,0,1.4256230675988808e+18,,"""sorry to hear that people felt harassed or worse""

This is one of the most tone deaf responses I have ever heard any con I know of in years. A person who is a known sex offender with the state of Florida should never been allowed into the con period. 1/ https://t.co/E98Y4GpGZF"
15419731,2021-08-12 02:47:38+00:00,1425650152795037699,en,0,0,0,0,1.4256230675988808e+18,,"So after having been informed that a sexual predator was planning on attending, they did nothing, at least one person was assaulted, and now they’re sorry that anyone “felt harassed or worse”.

Look, I know we can’t all be professional con-runners, but this is straight-up absurd. https://t.co/vPiH7Cx1pV"
1280261582090653696,2021-08-12 02:13:37+00:00,1425641594733092868,en,4,0,0,1,1.4256230675988808e+18,,"""Sorry to hear that people felt harassed""

Victim shaming and gaslighting. Nice. Very cool.
I fucking hate it here. Pisspoor excuses.
When are we shutting down this con? They only ""care"" now that there is a ton of backlash, and by this """"apology"""" it's not even real. https://t.co/VaDLOxZNir"
819305181280145410,2021-08-12 02:02:46+00:00,1425638861695299588,en,22,0,5,6,1.4256230675988808e+18,,(cw: assault) “sorry to hear that people felt harassed or worse” is such a loaded statement that is making me legit see red. this is the most bullshit apologist ‘uwu sowwy’ fluff nonsense I’ve seen from a con in a long time. full stop. https://t.co/YjrNdA9Ua2
32272736,2021-08-12 01:43:34+00:00,1425634030976909313,en,1,0,0,1,1.4256201528218788e+18,,"While the regime tries to create enthusiasm w/timid economic reforms, hundreds of Cubans r being detained for political reasons journalists &amp; activists are harassed dozens of mothers mourn the prison of their children. #CubaMuere I'm sorry we don't understand each other #soscuba https://t.co/XXf7zNK40b"
380637088,2021-08-11 17:06:03+00:00,1425503791416324098,en,2,0,0,1,1.4254494382025482e+18,,"Sucks for the doctors being harassed, but I feel so sorry for all those kids that have to grow up stunted by their imbecile parents https://t.co/YVZI3JM5xL"
1377309449333841920,2021-08-11 16:38:28+00:00,1425496849968992259,en,3,0,2,0,,,"1. you can't possibly think women are so dumb they can't tell the difference between reality and fiction 
2. reylo was the canon ship of the sequel trilogy. what were we doing wrong? 
3. I'm sorry you got harassed
4. it's not your job to police the sw fandom https://t.co/eZQQepu4Mn"
4563206240,2021-08-11 02:51:28+00:00,1425288730978381826,en,4,0,1,0,1.425286218544124e+18,,LFF looking for new people to talk to getting harassed and bullied 24/ ! Get me out i’m sorry my stomach is small! https://t.co/1QsgoDmyM9
775688,2021-08-10 19:11:08+00:00,1425172885442752519,en,4,0,0,0,,,"Sorry, Alec. It isn't tragic. He sexually harassed women. He created a hostile work environment.

...see, when I see responses like Alec's, it says a hell of a lot more about Alec than it does about Cuomo. https://t.co/p6zTu7ODrb"
280192158,2021-08-10 16:58:14+00:00,1425139439001489413,en,3,0,0,0,1.4251231621744148e+18,,"The first two minutes of your “the justice system is deeply flawed and we’re going to do something about it” rant was the energy we were looking for during the #BLM protests, not your “sorry I harassed women 🥺👉🏼👈🏼” speech. https://t.co/a6ARLjVTJB"
77879012,2021-08-10 13:06:48+00:00,1425081197923799040,en,0,0,0,0,1.424865718026244e+18,,I'm sorry to hear that you were booed &amp; harassed because the mob thought you were from the BBC. But my sympathy is limited given that you are reporting for Putin's divisive channel RT &amp; effectively working for a country that is disdainful of the truth. Putin/Russia/&amp; RT stinks! https://t.co/kKP1N2OOvh
1172400317104709632,2021-08-09 12:30:41+00:00,1424709718107295748,en,0,0,0,0,,,I’m really sorry but I don’t need to be harassed by you  any more.😒 https://t.co/OTPIEiLGtb
38068818,2021-08-08 19:59:34+00:00,1424460296157020165,en,2,0,1,0,1.4244156293065892e+18,,People view fathers like glorified baby sitters as if spending time with the kids they helped make should be seen as endearing and sweet instead of REQUIRED BC THEIR YOUR KIDS TOO DUMBASS. I’m sorry you’re getting harassed by people who don’t know what a father should do https://t.co/EI7ThWXHXR
20637254,2021-08-07 20:41:32+00:00,1424108470853320709,en,19,1,0,3,,,This individual helped PLACE publish articles stating TTC engaged in physical violence after a rally where PLACE supporters ACTUALLY verbally &amp; sexually harassed my students &amp; threatened a small group of us- all Black &amp; Brown- w police violence. This tracks. I am so sorry @AkieaG https://t.co/5xCd1HwJT0
1402544605497860100,2021-08-07 20:18:05+00:00,1424102569157222400,en,2,1,1,0,,,Sorry but how I'm getting harassed for commenting into my oomf who didn't @ any names or attacked any one with ' I still not processing it ' is now what make u all turn all this shit about jh and make it into fanwars ??? https://t.co/3QOuehlMHr https://t.co/id5CVQh0GY
158522822,2021-08-07 05:11:10+00:00,1423874336348413952,en,0,0,0,0,1.3804754400375153e+18,1.4238737902416118e+18,"Sorry, 2018. and yes, police, FRSC et al harassed me a few times while driving on Lagos roads because of it, demanding that I go collect the card as though I kept it under my bed and refused to use it. smh. https://t.co/UBN7nHp4S8"
268801278,2021-08-06 14:48:10+00:00,1423657153819258883,en,0,0,0,0,1.4234912908477604e+18,,"@twcuddleston I feel so sorry for your dad, being harassed and publicly shamed by his own daughter.  #ShameOnYou And btw, your dad is a rockstar!! https://t.co/YvpY8Ai0sN"
1187360028258373632,2021-08-06 09:05:29+00:00,1423570913463840772,en,4,0,2,0,1.4235197443600302e+18,,"Idc and all, but don't deny facts. I had people under my analysis posts ( Completely unrelated) say Bkdk siblings unprovoked. Same with other posts by people I follow.
People were harassed yesterday, so some are gonna harass you back sadly. That is how fandom work. Sorry. https://t.co/N7aNz5YAaa https://t.co/Q8rTJNH4ap"
1348795228833144832,2021-08-06 06:53:23+00:00,1423537670026838016,en,3,0,1,0,,,i still havent read the entire thimg bc frankly im too scsred to (if someone could summarize id appreciate it lawl) but i legit didnt give a fuck abt the joke mate like all i was really ocncerned about was him apologizing lol. im sorry ur gettimg harassed and u were made fun of https://t.co/PRoRflX4zU
1386197373085536261,2021-08-06 05:49:18+00:00,1423521544127631362,en,10,0,1,0,1.4234696574162493e+18,,"Gosh, I actually feel sorry for you and whoever was harassed like that by Zee.  If I'm being real, this kid needs to go to prison or at least get real mental help.  This could actually contend with even mickle for the most toxic c***t award. I'm ashamed I ever was friends with 1/ https://t.co/JWxiPUyR1t"
1415899399587303429,2021-08-06 05:44:37+00:00,1423520366132092929,en,4,0,0,0,,,"""but as my friends are now being harassed about this too, i’d like to give the benefit of the doubt and address it"" so u dont give a shit? ur not sorry https://t.co/abi4kFpnJ8"
1302625810252140548,2021-08-05 13:32:00+00:00,1423275599217397765,en,2,1,1,0,,,／／； I’m sorry but as someone who was harassed by the man you are referring to 、it’s not as easy as block and move on sometimes . Unfortunately he was a friend of a lot of people I knew 、blocking him would cause a lot more hassle for not just me but everyone else involved . https://t.co/WyF2lWpGIe
