author_id,created_at,id,lang,public_metrics_like_count,public_metrics_quote_count,public_metrics_reply_count,public_metrics_retweet_count,quoted_id,replied_to_id,text
1017971924654178304,2021-08-05 04:14:51+00:00,1423135385140359169,en,0,0,0,0,,,"I’m sorry you were depressed and harassed, but you’re also taking a hashtag as important as #StopAsianHate and devaluing it by creating something for your selfcestship. Pls stop talking https://t.co/HIk5objDJF"
1689798216,2021-08-05 01:14:02+00:00,1423089883384623105,en,10,0,0,0,,,"He should at least address the issue directly instead of just ""I'm sorry to everyone I hurt"". Like own up to the fact that you sexually harassed people and that your persona has been a fraud https://t.co/hyuTBAi8up"
1012031909059350536,2021-08-04 22:18:05+00:00,1423045603941044229,en,0,0,0,0,1.4230435953560166e+18,,I feel sorry for the women he's harassed but I feel rage for the elderly he killed. Impeachment is not enough. https://t.co/Q3tS4AwRrK
1428819438,2021-08-04 16:01:35+00:00,1422950852805935108,en,0,0,0,0,1.4226983615393382e+18,,"also, sorry to be the old lady complaining about internet safety, but minors please stop putting all this information that can very easily get you stalked and harassed like some of you are 2 seconds away from putting your social insurance/social security number and I get scared https://t.co/aFVoDlVLNH"
1329781136,2021-08-04 08:57:29+00:00,1422844126840586242,en,3,0,0,1,1.4225768206087127e+18,,Just wondering 🤔 if @mlg sexually harassed you as well with her massage? 😆 🤣@NMPatriot_45 @PinonPost I'm sorry that we have a gov that does this kind of stuff. Smh. You might be entitled to compensation. Just not on my dime. She owes the rest of NM an apology 🙄 😒 https://t.co/FwHE65ABBN
152763174,2021-08-04 07:38:15+00:00,1422824184934240256,en,0,0,0,0,,,Wawu this allegation looks like a reach. I’ve done many shoots and this absolutely  is not sexual to me. This Man is just doing hand placements. I’m sorry you felt harassed sha. Maybe u shouldn’t be modelling 👍🏾 https://t.co/YcfAHhZf79
1197358568183390208,2021-08-03 16:28:59+00:00,1422595361831628805,en,0,0,0,0,1.4225882817164206e+18,,"I’m sorry if they FELT like they were being harassed 🙄 but I personally never INTENDED to harass them through unwanted sexual advances and groping. Cancel culture, MeToo too far, I’m a victim wah. https://t.co/3V8ljTndim"
1046559976834158592,2021-08-03 00:40:38+00:00,1422356701823467521,en,2,0,0,1,1.4222027610562396e+18,,"I can weather this. Poor people are being bullied and harassed by Biden-Harris. 

If you voted Biden-Harris and are POOR. I'm sorry this happened to you. Stock up??? Yeah. https://t.co/yNVcLCEzyh"
178006522,2021-08-02 20:52:55+00:00,1422299395589017610,en,0,0,1,0,1.4219584414725693e+18,1.422295209518551e+18,"@the_moviebob I never called Shaun a eugenicist, I would never encourage a pile-on of a regular person (see below), and I’m also very sorry you’ve been harassed. I don’t agree with your views, Bob, but I’ve actually been outspoken against the harassment you receive 

https://t.co/eAbHnChiaA"
20739526,2021-08-02 06:54:57+00:00,1422088514905255937,en,7,0,0,3,1.4220182260079288e+18,,"it’s victim blaming, and it’s embarrassing to blame the victim in 2021, babe. no one is lucky to be harassed, and the focus should be on ending the harassment, not policing the victims of it. 

i’m sorry, @minimoogles. this is not your fault, and you don’t deserve it. https://t.co/Kvek749zxS"
1291867359238598659,2021-08-01 18:20:48+00:00,1421898723886567440,en,1,0,1,0,,,"I uh,,, didn’t want this to kinda blow up,,, but I’m glad you guys agree. But also I kinda want to delete this now, I don’t wanna start a fight, and I don’t want to be harassed,, sorry https://t.co/R6AR3tPmCI"
950257335615700993,2021-08-01 17:32:33+00:00,1421886584673038341,en,0,0,0,0,1.4218583397475574e+18,,no one deserves to get harassed like this i'm so sorry this happened changbin :( https://t.co/Tk80Co3FNm
274598380,2021-07-31 14:39:01+00:00,1421480526033014784,en,21,1,1,3,1.4214077400779366e+18,,"Reminds me of the time I was harassed continuously for over a month the same way. This person used multiple numbers. Stopped after my husband spoke to him - he said, ""aapki wife hai? Oh sorry then"" - because a woman's consent is of no value, apparently. https://t.co/NOBDZpCtrd"
1309541501970591744,2021-07-30 20:00:29+00:00,1421199034354737155,en,0,0,1,0,1.4210426401502167e+18,1.4211982457417114e+18,"@Jake___2003 @PortiaAntonia @kpumpin0007 @piersmorgan Sorry, what “fact” have you stated that you think has proved me wrong, numpty? I asked for the name of a white Male equivalent that Morgan has consistently harassed &amp; I got a non -answer about “vast majority”. 

Get in the bin 🤡.
https://t.co/hPvKOW3DAB"
1021829612693872645,2021-07-30 15:03:04+00:00,1421124189591937025,en,0,0,0,0,1.4211168045970104e+18,,"oh lord. i was harassed on multiple social medias. he was like ""youre with another guy arent u?? ur so childish for not responding"" one second and ""im so sorry i had a rough day, i miss you"" the next. he tried to readd me after 2 years just recently https://t.co/rLPvt3QhiP"
1171039198289133568,2021-07-30 11:32:10+00:00,1421071113904267273,en,0,0,0,1,,,"Everyone.. remember the tweet I made about Lynn getting harassed? Now it got worse.. Please please please.. If you can spare the time, help and support Lynn chan.. As for you Lynn *cuddles tight* I am soo sorry that you had to be a target for such awful people.. https://t.co/dmNXzLTN6s https://t.co/o6kGVWrOaA"
1001258552890134528,2021-07-29 21:19:41+00:00,1420856581563035652,en,0,0,0,0,1.4208551637330944e+18,,Officer Fanone. You are a hero and a courageous man. I’m sorry you are being harassed. People are disgusting. #Fanone https://t.co/d3T8WC6ri7
1321019481045479424,2021-07-29 21:13:03+00:00,1420854908958486528,en,1,1,0,0,,,"〘»ＯＯＣ〙•Most of my high school I was called every Asian slur possible &amp; (physically) harassed for my race, so it's nothing new at this point for me. And people wonder why I'm an introvert, lmao. Sorry to hear it. https://t.co/XKeAC9YDdQ"
882749520026771456,2021-07-29 13:31:34+00:00,1420738772795367425,en,1,0,0,1,1.4204401215062548e+18,,"Receipts.

I feel sorry for all the brave police officers who were harmed, killed, harassed, disparaged, and abused before, during, and after the 100’s of 2020 Floyd Summer of Love riots.
Capt Dorn.
But we’re supposed to feel sorry for the crying Pelosi museum cops?

Perspective! https://t.co/krWun3BOAW"
849400043065004032,2021-07-28 00:16:45+00:00,1420176362967642117,en,3,11,11,0,,,Yeah this is getting deleted cause apparently somebody came to me and said some Arab stans are getting hate. It's been way too many people in my mentions so if yuh did try to contact me about being harassed I'm sorry but I didn't see it. But your mutuals have come and told me. https://t.co/UU0iXb0zQq
1318719582639673344,2021-07-28 00:13:56+00:00,1420175657200410627,en,3,0,1,0,1.420175031301251e+18,,"To any of y'all who harassed this guy, I am not sorry.

You have no right to be mean to a person like Oshy who is highly sensitive to drama.

Oshy, once again, I am so sorry you had to go through all of this bullcrap and I really hope you'll feel better soon. https://t.co/bxunylQyWT https://t.co/0qrFO5y6lQ"
2447662261,2021-07-27 22:35:25+00:00,1420150861381181440,en,19,0,3,4,1.418615799259046e+18,,I am sorry that @BriReports experienced this behavior &amp; that the world still hasn't learned that teaching women how not to be harassed/abused isn't the answer. Instead let's teach our boys &amp; men that this foul language &amp; objectification means they're abusive. https://t.co/PhXjtlkfOB
955819103670824960,2021-07-27 20:48:24+00:00,1420123931915194368,en,3,0,3,0,1.4201234144094904e+18,,It’s sickening. I’m sorry but I feel sexually harassed at this point. We had an agreement and I would have NEVER gave him a Footjob if he would’ve said the watermarks would be on the pics like that and I had to pay wtf?? https://t.co/AlZ6GZYAAw
17531651,2021-07-27 10:34:30+00:00,1419969437105475584,en,0,0,0,0,1.4198240082924052e+18,,"Ma’am, I am terribly sorry you are being harassed by human Vermin.  God Bless you and your family! https://t.co/C7Rh42RpCP"
1172747606339907585,2021-07-26 03:24:54+00:00,1419498939615649793,en,0,1,0,0,1.4191659918424433e+18,,"So sorry for Chary!!! as another victim, I shared very similar experiences with her, sexually-harassed by Zheng Yongnian, bullied by EAI colleagues in work, while they spread around defamation, unfound allegation against me. I was fired with no reasons! and, NUS still lets them?! https://t.co/PpCCbUOs3q"
1182163123844726784,2021-07-25 16:07:21+00:00,1419328425836285954,en,45,1,6,47,1.419171665121063e+18,,"Foreign journalists were a sorry sight when they covered news about Zhengzhou floods — being harassed, hindered and assaulted by local mobs and plainclothes police. I’m afraid China is not safe for foreigners anymore.
#PressFreedom #ChinaFloods https://t.co/1DIAmQAlBy"
27490248,2021-07-25 05:30:55+00:00,1419168263682985990,en,0,0,0,0,1.418615799259046e+18,,So sorry that any woman can be harassed like that I'm just have to take ita lot of men are sick because they don't even think that it's wrong. https://t.co/sla4SNzlvQ
1331771346,2021-07-25 03:53:10+00:00,1419143662307627009,en,13,1,0,1,,,"I rmr the last time my friend and I went to the beach just us, we got harassed by this man on the beach. A nearby male next to us didn’t say a thing to him or step in. we had to leave cause we genuinely felt scared. So normalized. So sorry she went through this smh https://t.co/xFMhdKtmNV"
1370377374592856066,2021-07-25 00:12:41+00:00,1419088177760022528,en,3,0,0,0,1.4190802338321408e+18,,"I’m sorry but imma say it…I find it weird how the Kardash/Jenner clan only date black men, so when these black men go to other women especially black women, black women get bullied and harassed by their fanbase which most of them are white and non black poc. https://t.co/bjV81frBKf"
1344117198772600832,2021-07-24 19:26:53+00:00,1419016253226766341,en,13,0,3,0,,,EYE got rape threats. EYE had to go priv and block ccs from being sent because EYEM the one being harassed with rape threats and racism and whatever the fuck else you listed. i’m sorry that YOU choose to interpret a tweet that has a word count of my hand in the worst eat possible https://t.co/KVMxLdyl2D
24932347,2021-07-24 15:54:33+00:00,1418962819249233924,en,15,0,3,2,1.418615799259046e+18,,"This happens A LOT to women in general.  
I remember being an MMJ, working alone at night, &amp; being harassed this way when setting up live shots. 
The crude comments speak to the character of the idiots who make them. Sorry you had to deal with this, sis! @BriReports https://t.co/seyvP9p39s"
965176425685938177,2021-07-24 14:11:52+00:00,1418936975776751627,en,0,0,0,0,1.4181243832735048e+18,,"Whenever Remainers (like Semi) say ""I guess Brexit is working out, and our bullshit Project Fear never materialised"", REMEMBER:

People lost friendships winning this.
People lost marriages winning this.
People were harassed, abused &amp; assaulted winning this.

Sorry is too late. https://t.co/8QxDPzBffB"
13394572,2021-07-24 13:23:41+00:00,1418924851826413568,en,15,0,0,2,1.377967484389757e+18,1.4185738456283955e+18,"@gd_wilson I'm glad you are safe. I'm sorry you were harassed. Here is the best advice ever for dealing with police in any situation but especially if you are pulled over and questioned: 

https://t.co/gGVIE0uUEV"
40709265,2021-07-24 12:20:31+00:00,1418908952776122375,en,0,0,0,0,1.418615799259046e+18,,"This is just awful for so many reasons. I'm positive this isn't the 1st time she's been harassed, and sadly it probably won't be the last. Not the first time she's endured racist remarks right to her face. I'm so sorry she and so many women have to deal with such ignorance. https://t.co/kZddM9bZQJ"
179621873,2021-07-24 02:00:56+00:00,1418753033173884929,en,4,0,2,3,1.4186629543046922e+18,,I’m sorry Janice! It’s absolutely horrible that they will once again walk away free after the stupid decisions they made costing so many families heartache! While he stays in power and won’t even be charged for the women he touched and harassed! https://t.co/ahaDcAhiIE
32213446,2021-07-23 22:13:58+00:00,1418695914139443203,en,0,0,0,0,1.418326878843179e+18,,I’m sorry but this shit got my dying. How do you get harassed by a bear 😂😂😂😩 https://t.co/Ge62mykscT
1165361688796901376,2021-07-23 20:16:04+00:00,1418666242475536388,en,7,0,0,0,,,"""I'm sorry I stood there while you have to hear that. This isn't the first time you have heard this."" So you just stand there and watch her being harassed often?!? That's wild. https://t.co/jUpaJPMjaC"
1408376184233099266,2021-07-23 18:03:01+00:00,1418632759853998080,en,2,0,1,0,,,kula jehun is similar to the hindu celebrations and these type of events also includes free mixing . This is why we've got to stop celebrating eid like this. On one eid I went out in a new outfit and it got ruined by a group of men who harassed me I feel sorry for all the girls. https://t.co/8kbWT8Aam3
725972461242687488,2021-07-23 15:10:37+00:00,1418589372966969347,en,1,0,0,0,,,To my Brown POC I’m so sorry that y’all constantly get harassed by my people about your hair. I know y’all tired of this shit tbh. https://t.co/PSUN8aMXbs
2160517503,2021-07-23 03:37:33+00:00,1418414957729878021,en,2,0,1,0,1.4183793930015744e+18,,He harassed like 7 bikers today I’m so sorry https://t.co/tSluYaZec0
19145255,2021-07-22 13:00:49+00:00,1418194322156048386,en,2,0,0,1,1.417898786421158e+18,,"This piece is hilarious (and I feel so, so sorry for the harassed staff.)

""This year, it has gotten so out of control. If I photograph a kid and he has a bug bite, we're getting phone calls saying 'Shouldn't he be in the infirmary?'"" https://t.co/baowiGkSmD"
36869527,2021-07-22 12:52:44+00:00,1418192285536120842,en,13,0,0,0,1.4180179558419825e+18,,I’m so sorry to the woman that get harassed in this industry (and other industries). It’s not fair. It needs to stop. Changes need to happen. Hire more women. Hire more marginalized folks. It’s really not that difficult. This is all so fucking sick 😔 https://t.co/GYtCwJLm4a
1352113577931509761,2021-07-22 04:22:45+00:00,1418063943730348032,en,0,0,0,0,1.4179959976790303e+18,,Sorry but I thought I paid taxes so I could walk through a park with my kids and not trip over garbage or excrement or be harassed https://t.co/N2MhP33WQc
71728500,2021-07-22 04:07:55+00:00,1418060210011209731,en,2,0,1,0,1.4180510075655578e+18,,I want every person to know that if I've ever contributed to harassment or harassed you in any way that I'm incredibly sorry. I've done a lot of self work and culling of friends to make sure that I don't contribute to that culture at all. I also call out my male friends for it. https://t.co/daNvcsH9Sv
935962114807746561,2021-07-21 16:38:01+00:00,1417886594326011904,en,0,0,0,0,1.2870159459284541e+18,,oh wait you did post this already. SORRY I HARASSED YOU KEVIN LOL https://t.co/cPdkQhaM9Q
767329212747309056,2021-07-20 02:43:53+00:00,1417314288398573573,en,17,0,0,2,,,"1. Playing up a victim card doesn't negate that you sexually harassed people, Crow. Get off your cross, we need the wood.

2. Crow, just because you WANT to be right doesn't mean you are. I'm sorry to tell you this (I'm actually not) but you're, quite frankly, a very dumb person. https://t.co/1hn1ju4Pbx"
1350538454803898378,2021-07-19 20:21:37+00:00,1417218087686967300,en,10,0,1,0,1.41718415719782e+18,,"This is revolting, Dave is an abusive creep and I'm so sorry to the person he harassed. https://t.co/YeU6TjUDgd"
258135801,2021-07-19 19:54:41+00:00,1417211308265590793,en,67,1,4,10,1.417149845282775e+18,,"I'm so sorry this happened. 💛 

I've been a tall blonde femme since elementary school. I truly cannot remember a time in my life when I wasn't street harassed. And yet when I launched @HollabackOttawa in 2010, I endured endless backlash from men who claimed we were exaggerating. https://t.co/GMBquTsZUs"
3325160673,2021-07-19 11:00:39+00:00,1417076915110809604,en,63,5,19,5,1.4169377142853878e+18,,These SOBs going to boujie AZZ stores to protest…. YALL come to my neck Of the woods and find the right one. Also Amy Fleschert I am sorry these assholes harassed you Bc you wear a mask. Why this don’t happen to me? IWAMFKW https://t.co/JaAetOBtsJ
1368028527019384832,2021-07-19 03:48:16+00:00,1416968102705868800,en,3,0,1,0,1.416965478853931e+18,,"Sorry to people not being dicks as always after being harassed I'm not in the mood to play nice lmao nb people and lesbians can consider themselves men sometimes or partially men and we are not exactly ""nonmen"" https://t.co/n98KmGgvJ4"
124321371,2021-07-18 03:39:27+00:00,1416603496581828610,en,0,0,0,0,1.4162845965310484e+18,,"Damn you got beat, harassed, and raped? I’m sorry to hear that https://t.co/fjvPqKJVtC"
1148021608608518144,2021-07-17 21:07:51+00:00,1416504946841763843,en,18,0,6,1,1.4159073131944714e+18,,"Epic vent part 2

It also annoys me that people will come up with the most blatantly illogical and often contradictory statements and harass anyone who dares to criticize or points out gaping flaws 

Sorry if I'm being super vague, I just don't want to get harassed for my opinion https://t.co/jPCBeSBSvT"
1171164330219528193,2021-07-14 18:05:29+00:00,1415371887929135106,en,1,0,0,0,1.4152381847919043e+18,,"oh im sorry? have we not been harassed for weeks just for liking a ship??? and now you’re demanding we don’t talk about it bc the finale didn’t go your way?? guys i think i-
 i think i have to laugh! https://t.co/nx00D7EsFS https://t.co/Ms0C5Ovb4R"
830170315,2021-07-14 16:21:11+00:00,1415345642814181378,en,3,0,0,0,1.4150691167807488e+18,,"Ahh, I feel so sorry for him and feeling harassed. What goes around, comes around representative. Don’t like being in the spotlight, maybe it’s time to move on. https://t.co/9n7z2l45ih"
1267150310981550081,2021-07-12 04:17:32+00:00,1414438752030658560,en,8,0,1,0,1.4143782469807923e+18,,yeah im just gonna block people who mass harassed/ qrted her because thats rancid and i dont want that in my space sorry!!! https://t.co/jVTH8m7qGT
1407864591405694980,2021-07-12 04:13:36+00:00,1414437764460945408,en,2,0,1,0,,,"this is really triggering to me as i am someone who has been sexually assaulted and harassed...first of all i just wanted to say i am deeply sorry u had to see that and second, threatening to rape somebody over drawings is immoral and sick. how fucked do you have to be https://t.co/9istIrduBu"
854114636182028288,2021-07-11 16:26:50+00:00,1414259900046249991,en,4,0,0,0,1.4142541753120973e+18,,"good for you. #they don’t need to be spoken of anyway. I’ll be glad once they fade into obscurity. I am sorry you’re being harassed and sent threats though. that’s never ok, especially over some stan sh!t. https://t.co/8fw3v1Goae"
1040724770482991104,2021-07-11 15:15:03+00:00,1414241834721759243,en,7,0,0,4,1.4142390572411208e+18,,"(sorry if the message ended being vague but i wanted to go straight to the point. What's happening with @ticktacktickle is that they are being harassed because of their sona again. Because the Sona's nickname/name is ""The Tickle Monster"" so they are calling them horrible things.) https://t.co/HiN2MYqKec"
41558743,2021-07-10 23:49:48+00:00,1414008988161777665,en,22,0,1,7,1.4138994430369587e+18,,"Sorry but I’m generally afraid of being harassed, raped, murdered and or kidnapped so I’d rather chat before going on a hella uncomfortable date… https://t.co/mUyvZinLvu"
2837783607,2021-07-10 23:35:21+00:00,1414005353516343302,en,5,0,0,0,1.4140047026610258e+18,,"Like, I’m sorry but I’ve seen that same locker room freak out over the placement of their co worker on some dumb list but you’re gonna stay silent when one of your co workers is literally being harassed to the point of deactivating their account?? Smh. https://t.co/FbIUcc4qhE"
962782051970711554,2021-07-10 18:12:14+00:00,1413924037605081093,en,1,0,0,0,1.4139050894088643e+18,,"True but I've been attacked by a bunch of armys (I am one too so chill) for saying ""I'm sorry you had to encounter someone like that"" to a person who was harassed by a baby army https://t.co/2Hz14d324t"
1228061089478455297,2021-07-10 12:07:46+00:00,1413832317173444608,en,0,0,0,0,,,"LMFAO She's not a victim of assault. She harassed someone and got her ass beat and then portrayed herself the victim publicly for sympathy until the original got released and then it was ""i'm sorry i'm growing"" get the fuck outta here https://t.co/CPtL8YTI3y"
1366191170632704000,2021-07-09 21:11:36+00:00,1413606787757101058,en,0,0,0,0,1.4132764101862769e+18,,That’s the lady who harassed them skateboarders. Bruh i’m sorry if she would’ve done that to my dog I would slap the shit out of her!! https://t.co/UwcPaBZTVq
1381364092703752194,2021-07-09 04:17:35+00:00,1413351603143331840,en,5,1,1,0,1.41321946479607e+18,,"I should clarify that this includes harassment of others not just me, even if I disagree with the person being harassed on a fundamental level. While I have been the victim of harassment campaigns in the past I am not rn, sorry if I made you worried for me. https://t.co/VfZ80A8HR7"
873140817291993088,2021-07-08 08:08:37+00:00,1413047355113312256,en,1,0,0,0,1.413046868423045e+18,,'absorbs and adapts external influence' I'M SORRY ARE WE TALKING ABOUT THE SAME COUNTRY WHERE BROWN PEOPLE ARE HARASSED https://t.co/8tjxAPihEK
3116201675,2021-07-07 23:34:44+00:00,1412918032343703557,en,1,0,0,0,1.412794571621294e+18,,"Why is is not in jail? He literally has sexually harassed, Molested, and raped women and children, I’m not even including the thousands of dollars of tax money he used to go golfing and stole for his own leisure.Why is he still alive ??He’s 75 can he die already? Sorry not sorry https://t.co/QayJcogxJo"
836439088764858370,2021-07-07 07:11:49+00:00,1412670672308998144,en,1,0,1,0,1.4125237954333778e+18,,"bring her back instead of james charles y’all have your priorities all messed up. sorry if i’d rather someone who brought laughter and happiness instead of someone who sexually harassed 16,17, &amp;  18 boys. she did not deserve this. please come back #freejenna https://t.co/RBrgKXZtuw"
1348395627697172480,2021-07-07 01:14:21+00:00,1412580715976351744,en,0,0,0,0,1.4100792901133804e+18,,"i am so sorry the people who love your work harassed you for that ending. it’s your story. you clearly had everything planned. nothing wrong with disliking the ending, just don’t disrespect isayama. https://t.co/33IwoEEx3k"
37703017,2021-07-06 18:19:30+00:00,1412476316008415232,en,4,0,0,0,1.4124681899890115e+18,,I never harassed her. I’m sorry if that’s a misunderstanding. https://t.co/5ZgzLYjQYN
1345797519339646978,2021-07-06 17:38:23+00:00,1412465965586079748,en,5,0,1,0,,,I'm sorry but the fact that you're acting like a teenager being harassed by adults for having fun is their fault is so ridiculous. Wtf is your issue? https://t.co/QaMB6PqjnD
715895844,2021-07-06 07:42:28+00:00,1412316000880574465,en,30,0,3,6,,,"This guy is literally in his late 20s or early 30s and harassed A LOT of women. Literally went from confessing his harassment to ""sorry if u felt uncomfortable i was trying to be friendly"" bro pick one.

No one accepts your half assed apology. Shove it https://t.co/TVL4B556C5"
1165178599193726976,2021-07-06 01:51:33+00:00,1412227688165638150,en,3,0,1,1,1.4122244729589678e+18,,Sorry she got sexually harassed at work (Um like every single Aussie woman I know has been at some point)  I don’t rate her politics and she won’t be getting my vote ever. #auspol2021 https://t.co/MRvhewI21Q
1148253945720123394,2021-07-05 22:36:38+00:00,1412178635327426563,en,10,0,0,1,,,"I gotta say, @AnaKasparian, I think some of us have questions. Sorry, but I am not one of the cool kids who gets to reply to your tweets so RT'd. If @jimmy_dore harassed you at work for yrs, why didn't you fire him? Or report him to HR? And we all saw your blackmail DM sweetie. https://t.co/XEYr48bsRB"
1082128282718531585,2021-07-05 04:19:43+00:00,1411902586538635265,en,9,0,2,0,1.4116974411837645e+18,,Proshippers in the qrt’s free block list!! I am so sorry to this person who is getting harassed 😭 if you see this I hope you’re doing ok https://t.co/HE980ZEbXL
711783223366262788,2021-07-04 15:22:08+00:00,1411706903000875012,en,154,3,10,25,,,"I am sorry that you got harassed, sister, and I know what that is like, but please tell me again how IMT tweets are responsible for this degeneracy? https://t.co/qs2QgOpm47 https://t.co/GIa8Bjs0Bp"
844322420391661573,2021-07-03 17:50:30+00:00,1411381854419173381,en,1,0,1,1,1.411232297945383e+18,,"@theayoadams sorry to read about this brov! Before I got my camera, I had seen friends harassed by the police for holding a camera and documenting street photography. It was mental. I got my own camera and I just didn't feel motivated to roll into the street.

RT https://t.co/L6sYC2cavs"
218366301,2021-07-03 17:39:10+00:00,1411378999062892550,en,2,0,0,0,1.4112866199282852e+18,,"Stans need to get it through their heads that threats like that are not acceptable and that there are civil ways to get your point across and saying disgusting things only brings bad name to yourself, fandom &amp; group you stan. I’m so sorry that you’re wing harassed like this *hug* https://t.co/4SW5onSzvI"
