author_id,created_at,id,lang,public_metrics_like_count,public_metrics_quote_count,public_metrics_reply_count,public_metrics_retweet_count,text
1383848075953725440,2022-06-19 16:12:23+00:00,1538555301502369792,en,43,14,4,3,context https://t.co/8gyVkW6FTC
1333832396026880004,2022-06-17 15:24:34+00:00,1537818490366746627,tr,3437,164,26,588,"Bu sahne senaryo değil, gerçek. Boğazı düğümlendi, yutkunamadı, sesi titredi, gözleri doldu; Türk kadınlarının sesi oldu. Cesareti ilham versin. 
Birce Akalay'a kucak dolusu sevgiler ve tebrikler. 🖤👏

#Mezarlık https://t.co/p9dXeVS7Om"
1250263923573420033,2022-06-16 14:57:08+00:00,1537449199888871426,ja,12873,4268,648,8381,@masayoshih 動画で見るとより酷いです。 https://t.co/VUOGOhF1TV
286998245,2022-06-15 19:35:47+00:00,1537156937212645376,en,34051,5622,1072,13518,"A Walgreens employee killed his 17-year-old co-worker after she rejected his advances. 

She reported him to her manager and said he made her uncomfortable. When she asked to work more hours, however, the manager said she’d have to work with him

https://t.co/Pa4Fdc0iwL"
3422365383,2022-06-11 13:22:55+00:00,1535613552882552839,en,3,1,1,1,"One day I will write a thread about how I’ve been facing sexual harassment for two years from my colleague, then became the most hatred person at work after reporting it!!"
286998245,2022-06-10 16:19:08+00:00,1535295510524960768,en,198,20,13,123,"Ginni Thomas, the wife of Clarence Thomas, urged 29 GOP state lawmakers in Arizona — 27 more than previously known — to choose presidential electors to help overturn Trump's defeat https://t.co/tgi1TPvXT6"
1489820663573622786,2022-06-09 21:46:03+00:00,1535015391960915995,en,0,1,0,0,"⠀
⠀
⠀⠀⠀ ⠀⠀— !
Blushing.

She loves getting her head patted by other people.

It definitely makes her feel very special and all happy on the inside. https://t.co/RRSSJQOGKD"
16469116,2022-06-08 02:19:19+00:00,1534359387904557056,en,10,2,9,2,"“I Reported Sexual Harassment by My Boss. A Week Later, I Was Suspended,"" former Rochester Police Accountability Board executive director writes earlier today. https://t.co/9xDS7MIvO3"
1221201026855907336,2022-06-07 20:30:14+00:00,1534271536630222849,en,237,5,6,61,"It has been brought to my attention that this person has been not only targeting innocent artists in the Dragon Age community, they have been targeting TRANS artists specifically. This behaviour is absolutely foul beyond description and I urge you to block them immediately. https://t.co/OnDX6yE9Za"
1408306125657759744,2022-06-07 02:49:37+00:00,1534004625824747521,en,433,16,105,112,"About Epic Mynd

Read: https://t.co/rECZafg6wy"
735715789,2022-06-05 00:38:10+00:00,1533246769110298624,en,17848,356,0,801,"My mental health is at an all time low between everything online and behind the scenes. I've already been having trouble getting back to messages but it's going to continue -as besides being overwhelmingly busy, I'm going to be trying to spend much less time online. I'm sorry. ❤️"
1277277500029071361,2022-04-01 03:43:57+00:00,1509738311614537729,en,5653,699,70,2096,"// flag discourse sorry boys
since the last person that made this thread got attacked for not being a lesbian, here I am, a lesbo, making it. thread debunking claims of this flag being problematic !! I'm sick and tired of seeing my gay / mlm moots be attacked for using it. https://t.co/k1uQbGTyNz"
912116150,2022-05-24 11:43:19+00:00,1529065504928940037,en,6097,95,155,2695,"Honourable Chief Justice High Court, our houses are being raided without cause and in violation of law. Our workers are being kidnapped and their families harassed. The court has deferred hearing till tomorrow. Justice delayed is justice denied. https://t.co/CK5v5gcQ50"
14293310,2022-05-20 12:33:00+00:00,1527628455415889920,en,221,802,364,34,"Eliana Dockterman (@edockterman): It's time to forgive Hayden Christensen for the ""Star Wars"" prequels https://t.co/mDnQw5SpOz"
245917255,2022-05-17 16:31:03+00:00,1526601199314608128,en,12,2,1,5,"I think this is one thing that so many struggle with. I know I have at times. We try to make ourselves appealing to the broadest audience possible. But what are we really doing? Compromising ourselves, losing part of who we are? (A thread) https://t.co/qeOT1IFJ2u"
1167571688780787713,2022-05-02 04:05:08+00:00,1520977665288667137,en,3,1,0,0,"@horrorfan96z @BakAnime Yep. He's just going there to harass attendees, Wyatt and Vic, and dressing it up as righteous behaviour."
1511712573552574471,2022-05-03 15:26:19+00:00,1521511477533982720,en,0,1,1,0,I'm not saying what he's doing is okay. But I sure as hell wouldn't be nice if I had to deal with the shit he's dealing with all the time. Even if the other person is nice to me. We have limits and he's clearly reached his a long time ago but instead of just letting him be — https://t.co/EatSV80X7k
1222027197256351744,2022-05-02 06:54:04+00:00,1521020178372476928,en,547,342,34,215,"very rough trans / may contain inaccuracies

""i was the student who broke into the stage during gyeongbok high school festival. my thoughts were short/i didn't think much about it. i'm sorry. i'm sorry to aespa's fans, i'm sorry for causing a controversy"" https://t.co/gKaqiJvNzF"
343549833,2022-04-30 17:21:15+00:00,1520453240587907073,en,543,106,442,25,Any wrestling journalists wanna hit me up for a comment on being faced with online attacks and harassment from @LanceStorm and @KennyOmegamanX  fans?
1347464534731218945,2022-04-25 18:47:25+00:00,1518662983500529664,en,39,10,14,0,"@Kailiveshere @Freddy_mp3 hey bassicly what happened is that a lot of ranboos approaches to the poc community came off as white saviourism and other stuff of the sort, specially his behaviour during bhm and his use of the word cracker, and the way his one joke was to make fun of his whiteness"
1085001075495624705,2022-04-25 06:54:48+00:00,1518483647992672257,ja,54,1,1,23,"あなた方が媚びているのは日本の右翼であって、ウクライナが現在戦っているプーチンと同じ立場の人たちですけど本当にそれで大丈夫ですか？

https://t.co/hbrniCAdnL"
1316632272007651329,2022-04-25 01:20:08+00:00,1518399427299667968,ja,2515,40,84,501,当館は把握しておらず対応が遅くなりましたがまずは削除となりました。制作者の歴史認識不足と思われます。ご指摘の皆様に感謝申し上げますと共にご不快に思われた日本の皆様にまずは深くお詫び申し上げます。
154259382,2022-04-21 20:28:40+00:00,1517238914196676614,en,3,3,0,0,"April is Sexual Assault Awareness Month. We are committed to changing the culture and creating safe and respectful spaces for everyone to live, learn and work.

One option to report sexual violence is REES (Respect, Educate, Empower Survivors). 

https://t.co/54NqCewFPc https://t.co/0xOxR84u46"
1437827239396003840,2022-04-17 13:34:09+00:00,1515685044467421185,en,125124,1985,411,10527,"this “i didn’t deserve this award, this person does” “sorry i’m not x” attitude is so annoying https://t.co/xSmPbmmLTD"
1269132220725411842,2022-04-15 19:01:31+00:00,1515042652558966789,en,170436,14001,10241,16066,"No matter your race, religion, gender, culture, identity. No matter your past, your age, your status, your country. We’re all from the same place.

We’re all important and loved and special. You are loved and you are worth it. 

spread some love there’s too much hate in the world"
2318294136,2022-04-08 05:26:26+00:00,1512300815549186049,en,2283,1172,7055,141,"I just ran into Andy Ngo at a bar in New Orleans. I politely told him he's a ""garbage person."" Lol"
1378503060893278212,2022-04-09 04:40:06+00:00,1512651545271103488,en,19,1,2,0,"I suppose I should address the whole raven situation. I wasn't, at any point, trying to send people after ANYONE. I don't think anyone should harass anyone. I was simply providing other people the relevant info that I had. It turned out some of that info may have been wrong. (1/7"
1456017152092164099,2022-04-01 13:15:24+00:00,1509882122382675968,en,0,1,0,0,"[ ah. Well this will go well. ]

Why yeah, we can talk for a minute. https://t.co/qzipp2HEkc"
1097497278640619520,2022-03-30 07:10:32+00:00,1509065522448519170,en,2383,150,259,628,"oh so it was that easy for them to show support for other members but for rosé, who was harassed for 2 straight days, they remained silent..."
1417717758976876545,2022-03-30 01:59:10+00:00,1508987165635940354,en,98,2,2,9,Blinks gonna support them again and ignore all the slutshaming twt they throw at rosé 👏
1349196499708596225,2022-03-21 15:47:11+00:00,1505934049877012483,en,193,29,23,7,Just received this dm of aphorism's semen on a print out of me. how is you guys' day going? https://t.co/e00GdxjliL https://t.co/bmI0lBJ0Th
744562371306397696,2022-03-20 09:03:58+00:00,1505470189818859521,en,59,4,19,9,"I am again seeing how this data from the UN is being used to justify treating all boys &amp; men as potential abusers

Hateful, prejudice &amp; unreasonable in my opinion

What do you think? https://t.co/sSp9zG5lmz"
1084293486222995457,2022-03-19 15:50:21+00:00,1505210072208711686,en,7,1,0,0,"Bro there's like 10 of us how are we worse, we get harassed on the daily https://t.co/v8VdFzcwxC"
1195486831896399875,2022-03-11 11:23:03+00:00,1502243701136973824,en,9,1,2,0,"@MinaVaderWho He hasn’t apologised properly, hence why a lot of fans haven’t really wanted anything to do with him. I don’t hate him, I agree he has probably changed and it was different times. But it’s a hard situation to move on from when he just won’t address the situation properly."
15199808,2022-03-11 11:31:29+00:00,1502245825258602500,en,1,0,3,0,"He's the ONLY previous #DoctorWho companion to return to work with Jodie Whittaker. So much for improving the ethics of the show, eh?

Did you object to that? Post a link pls?

I didn't, because I'm not that big a prude. If no one complained, I don't have an issue. https://t.co/16Bfzvfsax"
867761155808395266,2022-03-04 15:53:56+00:00,1499775158281637892,en,9,2,1,4,I think everyone needs to block this person even if they don't watch or read BSD https://t.co/tNU3qFRBQT
197554405,2022-02-21 01:46:25+00:00,1495575606104399873,en,74,36,73,32,Conservative senator MacDonald derides Ottawa residents in video | CTV News https://t.co/eYDvPAUbTw
123496161,2022-02-19 12:17:18+00:00,1495009597811273730,en,474,32,1,29,"Mafumafu says that from last year summer he interacted more with Person A, played games and they became friends.
He once again apologises for lying to his fans (Probably about how he says he doesn't interact with females before)"
3337933103,2022-02-17 19:42:16+00:00,1494396800106733574,en,7024,1005,1,290,i deleted the earlier tweets bc i sounded too aggressive. im really sorry i missed posting for any updates for a day and ill try harder to update everything or rt everything that they post but please i cant be on my phone 24/7 so if i miss something it really is a genuine mistake
1304255364158943234,2022-02-16 12:02:06+00:00,1493918608984096775,en,3,1,0,1,"@BootlegChzcakes @OBTinia I hope it sheds more light on what women, and men, go through from abusers, and helps educate more regarding the assistance and protections necessary to stop it!!"
1119460271423205376,2022-02-10 04:05:01+00:00,1491624217997197316,en,2,1,0,0,Oh it was just to apologize lol https://t.co/Xz2WTtPruR
1354838957272526851,2022-02-10 05:02:27+00:00,1491638674269872128,en,0,0,1,0,@S_2_silencieux Anything interesting? I’m nosy lol
1468299863033249794,2022-02-09 20:03:03+00:00,1491502926661099526,en,62,8,3,16,"Comaroff retraction letter has been released with 34/38 of the original Harvard letter signatories. Story here, screenshots of letter to follow https://t.co/L0RSlJXgmx"
4554394595,2022-02-09 00:40:18+00:00,1491210314314297347,en,28,2,0,1,just found our the person who plays barney or is barney ia a black man. tinfengs really just being casually racist and getting away with it huh ok
1431049652376416256,2022-01-30 20:18:26+00:00,1487882918919872520,en,700,16,34,24,Just to be clear: If anybody both publicly apologizes and deletes their tweet; I am not going to have it on my page. 👍🏽
16664681,2022-01-25 01:04:00+00:00,1485780457933488128,en,2382,772,636,407,British singer Damon Albarn has apologized to pop superstar Taylor Swift after saying in a Los Angeles Times interview that the artist “doesn’t write her own songs.” https://t.co/4wVEsI9fZb
1392246283579105281,2022-01-20 13:45:39+00:00,1484160193017614336,en,53,109,18,2,maybe we wouldn’t be forced to talk about bisexuals all the time if they would just leave us alone and stop harassing us when we’re right and have always been right lmfao
1291260823071936513,2022-01-13 01:36:00+00:00,1481439858111311874,en,277,52,5,43,this is why I believe it’s healthy to have separate space in a relationship bc this is me 😂 &amp; I don’t wanna annoy you because you annoying me https://t.co/hShuFWlDVI
1079743974305382400,2022-01-18 03:46:21+00:00,1483284601032355842,en,11,1,0,1,@bnnyhearted @thun_derhawk all i need to do is check my dms and i can still find messages from people who decided to harass me over it 😭
1453456992014671872,2022-01-17 08:02:08+00:00,1482986583456464897,en,0,1,0,0,"Some people need to understand that there are unpleasant things that we cannot change. For those things, you can either give into despair, or you can learn skills that help you cope with the unpleasantness. The second is almost always the better option &amp; why therapy is important"
1407750225146482690,2022-01-13 21:30:48+00:00,1481740538827182086,en,7,4,10,0,"@kurobe613 this person reposted your art, albeit gave you credit but didn’t even bother to actually tag you. Despite what they say I doubt their intentions were to just give your art attention, but rather to gain clout from racists https://t.co/1TwSPl5dCs"
2308319114,2022-01-10 15:41:13+00:00,1480565398319906817,en,120,25,6,21,"This aged well. It's almost as if it came out yesterday.
https://t.co/kWoTwuKBvG"
56612604,2022-01-03 21:08:16+00:00,1478110990050869248,en,187,224,91,11,"Proud to work for a news organization that challenges the status quo, elevates voices that aren’t typically heard, and that is working, bit by bit, to right the imbalance that has existed for so long. If you’re uncomfortable w/this, reflect on your white supremacy."
1313163773419683840,2021-12-30 02:52:30+00:00,1476385680494317569,en,2,2,2,1,@KittyLovesCups @Sciomancer Your little cute fucktoy boyslut
722775086,2021-12-29 19:51:31+00:00,1476279735659515905,en,31,1,0,1,@ilze_greyling @hadesrpb (text as a pic since didnt fit n didnt wanna post an actual thread lol) https://t.co/e8lsO5WOv1
4321232173,2021-12-27 03:31:06+00:00,1475308230871957507,en,95,161,23,29,"So, no ratio now for the 3 who actually contracted Covid while going around on a definitely unsafe period? Where are you f*cking noisy b1tches who kept at it for JK who was out when there were no restrictions in place and didn't get infected? You made him apologize for nothing."
50772918,2021-12-16 02:40:14+00:00,1471309162676207617,en,14152,315,456,2935,The CEOs of Southwest and American Airlines both said today in Senate testimony that masks on planes serve no purpose. https://t.co/ehz7LFesas
36339032,2021-12-13 12:16:14+00:00,1470366954963841029,en,1853,643,277,87,"Latifi has apologised for his #AbuDhabiGP crash, saying it was never his intention to influence the #F1 title battle.

https://t.co/n39BOgqDdy"
1403386664408518662,2021-12-12 22:37:08+00:00,1470160818947960839,en,0,1,1,0,"It became too much and I broke. I never claimed to be perfect. There's no justification for how I responded to being shit on by so many people. All I can do is try to do better. That being said, those who have spent time with me know how I treat people."
1367531,2021-11-29 20:30:00+00:00,1465417783089545223,en,738,211,1570,87,"Rep. Omar hangs up on Rep. Boebert after tense phone call
https://t.co/SGMRFkaXm0"
978265628426432512,2021-11-26 18:30:50+00:00,1464300631334789126,en,812,58,282,117,"From her Representative Twitter account, Lauren Boebert is attempting to put these hateful, Islamophobic comments behind her. https://t.co/oYmGY1DH6J"
17852343,2021-11-06 02:53:45+00:00,1456817048265400320,en,9143,16879,2799,701,Chris Pratt went to bed 'upset' and 'depressed' following social media backlash https://t.co/vrmbN2vFqu https://t.co/P87kE0fTFy
66214850,2021-11-04 00:59:22+00:00,1456063487051018240,en,300,1,4,48,"Why would I wanna talk with someone who defamed me? Someone who labeled me “lesbophobic” and told people to STEAL from a Black disabled queer woman and the entire team? 

You can’t be serious. You and all those stans kept this shit up for MONTHS harassing me on every platform. https://t.co/kS9Hck5v6z"
791069085454827520,2021-10-30 19:55:11+00:00,1454537387372122119,en,46347,1911,1727,9038,Just another day being a woman in the world! The amount of times that I deal with street harassment as a female journalist who works alone is exhausting. Notice how quickly this man got angry when I tried to *politely* dismiss him so I could DO MY JOB. https://t.co/jKsnQMfsIs
3197363940,2021-10-26 03:38:26+00:00,1452842026362290176,en,1336,128,40,55,"I keep being called out and harass for 4 months until now for saying editing art is bad, I even said sorry for it 🥱Can't people just go outside and touch some grass? It's like they don't have their real life and their 2D life is everything to them so they need to fight for it"
1440435793139408901,2021-10-03 05:33:08+00:00,1444535969718353922,en,1,1,1,0,@OutsidetheBoard @DonoraBeaveguti @ArrestCrooks @artofmmignola This is the user NomadicTrek from back in 2016. Bottom left. He is an old man. https://t.co/Gqv8CU37Xc
1440435793139408901,2021-10-21 22:16:02+00:00,1451311341168435211,en,0,0,1,0,"@ArrestCrooks @NomadicTrek @FBIDenver @FBI Well now that Brian has been confirmed to be deceased, will you apologize to NomadicTrek now??? Or do you STILL think it’s Brian communicating from beyond the veil?"
430958876,2021-10-13 17:03:01+00:00,1448333464604917770,en,462,53,247,28,"I can have thousands of people insulting me, huge influencers roast me, Cory Barlog himself ridicule me, and that's fine. But this shit right here is where I draw the line. I'm taking the post down because this is insane. https://t.co/sqe78Zphd3"
2713098134,2021-10-08 22:18:40+00:00,1446600960449593346,en,20910,241,77,3054,nO oNe wAnTs tO wOrK!1 https://t.co/X0asAIdCi5
983060901711499264,2021-01-08 14:46:07+00:00,1347555186760437760,en,15,8,11,0,"Please give this a read. I'm sorry to the people that I've hurt, and I'm actively working on my behavior and bettering myself. https://t.co/Ws326M03sM"
21366823,2021-10-02 05:08:59+00:00,1444167506260893698,en,3115,570,145,375,"The Boyz's Sunwoo snaps back at a fan who told him to lose weight, then apologizes for his 'impulsive comment'
https://t.co/vsAsauJqlW"
1332650901711036417,2021-09-26 14:09:27+00:00,1442129190933839875,en,4,1,1,0,"Them: “I do still consider you a friend” [discord 06/05/2021]
Also them: see picture (not only twitter tho)

Reason? I told them I was suicidal 🙃
I can’t believe I hurt myself, got depressed and wanted to die because of this. I love my friends who r still with me 💗 https://t.co/weSR2o1oRs"
851163722718609409,2021-09-26 07:32:31+00:00,1442029300056797185,en,1,1,0,3,@TwitterSupport @TwitterSafety someone replied to me on a text thread. I did not initiate w/ them. I’ve reported this behavior so many times. Is anyone willing to stop sexual harassment? Are you @Jack? https://t.co/cOwNQRs3jy
1640929196,2021-09-25 14:27:12+00:00,1441771272216645637,en,12390,161,515,3011,"PRO TIP: Don't waste your time and energy arguing with trolls. It makes no difference, they are here to stir you up and piss you off.

Just block and keep it moving. That's how you win.

PASS IT ON."
1065703451051593728,2021-09-19 08:28:13+00:00,1439506602143399937,en,1482,15,790,41,"Dear Roblox players, have you ever met a toxic player in a game?"
1396138228340510725,2021-09-17 16:06:59+00:00,1438897279532818433,en,301,4,147,17,"To the ladies, have you ever been harassed by a man, whether you’re walking by, or at work, or just sitting on a train or bus? Even on twitter? I reckon a lot of us have at one point or another"
272985460,2021-09-11 03:21:50+00:00,1436530396330663936,en,198428,395,192,8879,things are heating up at the alley https://t.co/Br54bafDt1
253178454,2021-09-01 17:05:42+00:00,1433113851684442120,en,3238,151,162,291,"So Shoe is now the social media coordinator for a deeply RW populist group. It seems they endorse exclusively RW candidates, they oppose vax mandates FOR TEACHERS. Other members are 'patriots' who commonly RT Don Trump Jr &amp; other RW dorks... 

Wowee zowee, Shoe has come so far... https://t.co/hBQ3U3EFpZ"
2176796415,2021-08-31 09:04:17+00:00,1432630309439299587,zxx,2,1,2,0,https://t.co/6nLpjR6NgH
335996055,2021-08-26 14:57:43+00:00,1430907314043719683,en,23882,2632,4373,10850,"We can confirm that the explosion at the Abbey Gate was the result of a complex attack that resulted in a number of US &amp; civilian casualties. We can also confirm at least one other explosion at or near the Baron Hotel, a short distance from Abbey Gate. We will continue to update."
277880167,2021-08-26 14:51:01+00:00,1430905627287511052,en,321,2,24,6,"@mtaibbi @chadloder @RonnieMcCrayJr Yes, I 100% understand that you don’t care about this issue unless it directly affects you—that’s the whole point!"
1413636084953669632,2021-08-24 14:33:36+00:00,1430176468156485633,en,209,4,3,16,"psa: stop pretending like the fandom is perfect. there's tons of drama, it can be toxic, there's people making u feel like ur a fake fan every minute. people are lovely. but we should speak about all things in the fandom instead of acting like it's all butterflies and rainbows"
1405009250913599489,2021-08-19 20:27:43+00:00,1428453648095498243,en,4,1,1,0,"@bath_boi @OfficialGami do you ever stop talking about Vaush? you've tweeted about him so much recently it's actually nuts 
https://t.co/4EqXDepJsE"
2158712993,2021-08-19 17:10:30+00:00,1428404013876322304,en,2030,1661,529,961,"This gent sent through a voice note to a talk show, about how his wife was gang raped by 3 guys while doing her first year and she is still traumatized by it. What's eating him is that she doesn't know till today that he was one of those 3 guys and doesn't know what to do 😩"
23970102,2021-08-10 17:25:55+00:00,1425146404603940867,en,2509,1221,6382,372,"Like Cuomo, many of the loudest woke voices have quiet resumes that are appalling; especially in the media and in Hollywood."
232268199,2021-08-10 15:53:34+00:00,1425123162174414851,en,3254,731,4864,826,Addressing the people of New York. Watch LIVE: https://t.co/0DOItVsW23
2703256003,2021-08-01 14:28:00+00:00,1421840140863946752,en,3,1,1,0,@MgtowRadical @BlackMambaFan09 @BiddyCross @stevek3384 @amanda_pompili @MasterMorgan317 @3nigmatic_01 @beeonroids @ValyrianRose @ShotgunRain5746 @joy_afi @AliceCasper16 @DavidsonYorick @Noellenarwhal @missmiaow007 @TinFoilAwards @EXPELincels @athenapandora7 @Tekla_Too @annaeck73 @SR_Duncan @AvaGraceVIP @Wakerifes @GameOverRos @fountainclown @j_bbrav0 @eatadickchad @blackishmonday @IchiRuki04 @shakesp33194389 @ScienceBackyard @duran_fan33 @Jim49051110 @SuperRealScott @BynameRose @SlenderSkeptic @NinjaSocialist @AnnmarieSwims @Pissingmyshort1 @Holdenheim1 @aladrost @ChrisTarrant8 @RogueArtemis @SigmaKushWaffle @Ponderer_O_Purg @MedusaHypatia @FlaviusPetrus1 @aGPSisbetter @Purpleh10028498 @Scrappy07728771 Only to that man. If you're worried about who I married you can eat my ass
2703256003,2021-08-10 15:20:55+00:00,1425114948074627078,en,5,0,2,0,"@MgtowRadical @MasterMorgan317 @stevek3384 @ShotgunRain5746 @AvaGraceVIP @AliceCasper16 @missmiaow007 @3nigmatic_01 @Awithonelison @ValyrianRose @amanda_pompili @BiddyCross @beeonroids @athenapandora7 @aladrost @EXPELincels @DavidsonYorick @BlackMambaFan09 @joy_afi @Noellenarwhal @TinFoilAwards @Tekla_Too @annaeck73 @SR_Duncan @Wakerifes @GameOverRos @fountainclown @j_bbrav0 @eatadickchad @blackishmonday @IchiRuki04 @shakesp33194389 @ScienceBackyard @duran_fan33 @Jim49051110 @SuperRealScott @BynameRose @SlenderSkeptic @NinjaSocialist @AnnmarieSwims @Pissingmyshort1 @Holdenheim1 @ChrisTarrant8 @RogueArtemis @SigmaKushWaffle @Ponderer_O_Purg @MedusaHypatia @FlaviusPetrus1 @aGPSisbetter @Purpleh10028498 Do you mean tweeted, because if you are saying I have messaged you, you are categorically lying?"
3238448948,2021-08-06 05:37:32+00:00,1423518582583939077,en,760,29,14,225,"A periodic reminder that if you're dealing with harassment on twitter, check to see what lists you are on. This one wasn't going anywhere, but sometimes these have hundreds or thousands of followers. 

If you block the list owner, you are removed from the list. https://t.co/GSZ5E3fWn3"
1331558059349458944,2021-08-03 12:34:28+00:00,1422536343872098310,en,7383,895,27,2720,"[💌💭] 210803 

Message is here! 

(sent 9:23-9:30PM KST) https://t.co/hz1i9ItEud"
261137809,2021-07-20 05:55:15+00:00,1417362449154539522,en,0,1,0,0,"For the sake of having my point stand on its own merits I have [REDACTED] the names of those involved. 

If you do not want to be harassed it is a good thing to practice not harassing others. 

If you want to be treated with respect, treat others with respect. PERIOD #philosophy https://t.co/RxZJny2Pzv"
1344117198772600832,2021-07-18 18:21:03+00:00,1416825357584457740,en,6,1,0,0,If i had a large platform my apologies would be way better than these big profile people
