author_id,created_at,id,lang,public_metrics_like_count,public_metrics_quote_count,public_metrics_reply_count,public_metrics_retweet_count,quoted_id,replied_to_id,text
2385382867,2022-04-21 16:42:44+00:00,1517182054223560704,en,3,0,0,0,1.5169290855109796e+18,,"I'm sorry, Paula. It's horrible that you have to be criticized and harassed simply for being the wife of a professional esports player. 

You deserve to heal away from all of this garbage and find peace. Wishing you nothing but the best. https://t.co/QbJXEUIrV2"
1433631203614150657,2022-04-20 17:00:50+00:00,1516824221154004997,en,1,0,1,0,1.5160240514955428e+18,1.5168225958318408e+18,"@Afaq5485697 @GHOSTFI000 @Analog05097440 I feel sorry for your women.  This image can never be in Turkey;  When a person is harassed here, a lot of Turkish men beat the harasser.
https://t.co/ydh0Of9TpU"
32288714,2022-04-19 16:26:49+00:00,1516453275788267530,en,6,0,1,1,1.5164266221608428e+18,,Once you play victim it doesn’t end until you stop playing victim. Ask any real victim who has actually overcome it! THEY did the work. It stops then! Because you can’t be harassed if you don’t participate. And this will trigger all the victims who haven’t overcome yet. I’m sorry https://t.co/E4ltJS2kHq
1134145998064902144,2022-04-19 14:42:44+00:00,1516427079314722818,en,2,0,0,0,1.51411562878908e+18,,"I imagine the auditor fining cops if they haven't met their dead dog quota for the month.
""Sorry, Bob. You've only harassed 20 teenagers this month. We're gonna need you to bump that up to the regulatory 35 per month"" https://t.co/5i1oQ5jlPb"
942763024036913153,2022-04-19 12:46:46+00:00,1516397897293643777,en,0,0,0,0,1.5163691170323743e+18,1.5163691170323743e+18,"@wahlstedt007 I am so sorry SID! Because of my response to you, I am getting harassed and called stupid, today. AND I HAVE NO PROBLEM WITH THAT! However, it shouldn't be allowed on this site! THAT IS THE REPUBLICAN WAY!!
https://t.co/akBjIveEhh"
1135058203249524736,2022-04-17 20:36:11+00:00,1515791251991277569,en,0,0,0,0,,,This whole Kyle situation is fucked I’m really sorry to everybody who he harassed grown man was talking bout “Huggies” that’s insane https://t.co/GqOFAAYgPf
1500459941135634436,2022-04-17 04:11:58+00:00,1515543569070796802,en,0,0,0,0,1.5154400110632755e+18,,"""oh, sorry I didn't show up. My name is Watanuki. Nice to meet you.""

He bows slightly.

""I know a little bit about the business, since I was little I've been harassed by spirits."" https://t.co/0ERf2gXl12"
424597562,2022-04-16 23:12:21+00:00,1515468167669235730,en,65,0,6,23,1.5154342368782336e+18,,"READ THE ROOM!! 

A lady was sexually abused, robbed, and harassed in your country. All you can tweet tonight is how we call it Zanzibar and you call it Paradise. I'm sorry but using a picture of a woman while there was a woman abused there is heartless. and um🔜 wakho. https://t.co/9ZGnvkR7GN"
1491780030497976321,2022-04-16 07:17:03+00:00,1515227758078529536,en,1,0,1,1,1.5147382262920438e+18,,Unrelated but this is sth that could happen irl. I feel sorry for the boys sometimes wn they cant even talk to someone they know freely without being harassed by people who call themselves 'fans' ☹️ https://t.co/2ulFRYzc7b
1271479172989218818,2022-04-15 19:24:12+00:00,1515048360687779841,en,256,3,6,20,1.5150426525589668e+18,,"All what Dream has to do: ""I'm sorry to Bitzel, people who got harassed, and others. I'm sensitive to valid criticism and will do better""

Just apologize bro. Not that hard. https://t.co/R7oEtyIC4L"
1497451748906123268,2022-04-15 14:14:59+00:00,1514970545141526529,en,45,0,0,3,,,"HE LITERALLY SAID TO YOU “SORRY, I REALIZE I CAUSED YOU TO BE HARASSED, I DELETED MY REPLY” ONE SENTENCE AND HES SAID MORE THAN DREAM CAN EVEN PIECE TOGETHER IN HIS HEAD https://t.co/0qAES0Yscv"
1435350140248801285,2022-04-15 12:36:26+00:00,1514945743773126668,en,15,0,1,1,1.5148728838515466e+18,,i’m not even angry anymore… i’m just numb… i’ve seen far too many of these in the past two DAYS like i don’t even know how to feel anymore. i’m so sorry felix and anyone else who’s been harassed and threatened and even doxxed simply because they like dream https://t.co/ceQwrLcUAe
2782173552,2022-04-15 09:44:09+00:00,1514902389790232577,en,0,0,0,0,1.51488309865941e+18,,"I am Sorry! On behalf of whole Nation! I condemn this type of politics! Families of political leaders should not be harassed in any way, might it be Nawaz Sharif's family or IK's Family...#StopExtremism https://t.co/BkGD1DHf1X"
1088273262780534785,2022-04-15 03:36:54+00:00,1514809967131299848,en,0,0,0,0,1.5144440605215498e+18,,"can everyone in valley just take a moment to appreciate the fact that i’ve grown up, am medicated, and i don’t start fights on social media anymore 😭😂 like i really am embarrassed and very sorry for my behavior lmaoo. if you’ve ever been harassed by me I’M SORRY😩 https://t.co/aTOII0U7be"
4808970252,2022-04-15 01:50:19+00:00,1514783145303834624,en,141,0,5,6,1.5147044355276513e+18,,"holy fuck preach. sorry for rant post, skip my post if you just want comfi contents, but man 
even from a young age i was sexually harassed all the time for nudes, or photos i didnt want to take. 
i chose to not take them and it made me feel inadequate. double standards man https://t.co/PhNuuYe2uF"
1159050827224555520,2022-04-14 00:17:37+00:00,1514397428006494220,en,7,0,0,0,1.514330841576624e+18,,"“haha yeah sorry i set my fanbase on you and got you doxxed and harassed but you’ll be fine! you’re not rich and famous like me, do you even understand the hardships i face in my life? you only have seven followers like who would even care to stalk you” SHUT UPPPPPP I HATE HIM SM https://t.co/av5AEQV8Ri"
1323497499324080129,2022-04-13 16:02:41+00:00,1514272871916310531,en,1,0,0,0,,,"Nah that's so dumb
I'm so sorry Cynda
Getting harassed for not liking something https://t.co/LRKF6YbstH"
1095658586158571521,2022-04-13 15:51:30+00:00,1514270057425211401,en,3,0,0,0,,,"sorry that i cant empathize with someone who likes seeing kids be harassed, lied about his kkk edit and uses the fact that his fanbase fetishizes gay men for damage control https://t.co/QE24vBibyX"
1393212839075008523,2022-04-13 15:36:28+00:00,1514266274812993538,en,6,0,0,0,,,Sorry but i dont rly want to show empathy to someone who has made so many people uncomfortable with the things he has said and not apologised for + so many cc’s have gotten so harassed by his fans and he has never spoken out about it https://t.co/1GMlTdtzDG
247936922,2022-04-13 12:26:30+00:00,1514218467284725766,en,6,0,0,1,1.5142087560784527e+18,,"This is why election posters need to be made obsolete. No one should be targeted, harassed or attacked over a piece of plastic. 
Sorry this happened to Elsie or anyone else over the course of the last few weeks, but I feel a line needs to be drawn. No poster has changed my vote. https://t.co/xWX9o8BZbH"
1230599447786082304,2022-04-13 01:50:28+00:00,1514058405488513028,en,219,2,0,25,1.5139009227616174e+18,,"See why armys don't fck with kpop stans bc y'all just wake up and think ""how can I harass armys &amp; hate on bts today"" sorry that bullying is apparently equivalent to minding our business until our faves get harassed by y'all https://t.co/RoAv1pZeUX"
1460188112,2022-04-12 20:33:40+00:00,1513978680632131596,en,19,0,3,0,1.5139657627839488e+18,,"Are you GOD DAMN KIDDING ME Twitch?! 🤣

There was a time where I was harassed / called slurs on a DAILY basis on their platform. I suggested &amp; campaigned the (recently implemented) fix YEARS ago!

""Sorry we missed this! 🤷🏻‍♂️"" 

I actually wish they never wrote back! https://t.co/thvit8aaQM"
1496074920660729858,2022-04-12 15:48:12+00:00,1513906838882103296,en,5,0,1,0,1.513853433559896e+18,,"I'M CONSTANTLY HAVING A NIGHTMARE.

FEEL SO SORRY FOR OFF .. HE GOT ASSAULT// HARASSED THAT DAY,..??? I FEEL HIS TRAUMA. . GOOOSSSHHH! WHAT A SICKO.... 

@oliveoile_ @Jingjingyu364  @pimwalee_
#ออฟกัน
#ออฟจุมพล https://t.co/EbxzXBTin6"
1481248892750544897,2022-04-12 03:26:43+00:00,1513720240793862154,en,0,1,0,0,1.513718650179666e+18,,""" Harassed?

I thought she was just slapping my– ""

☕: im sorry https://t.co/XReNYlXN7b"
2637900955,2022-04-12 01:45:10+00:00,1513694682634727427,en,1,0,0,0,,,I'm sorry you're being harassed. Please report the users. This is a crime and beneath anyone that considers themselves an ARMY. https://t.co/QSYU4b2CX9
1324520353050316802,2022-04-11 20:07:46+00:00,1513609774654533636,en,0,0,0,0,1.513280502643503e+18,,I honestly feel sorry for them women who get harassed by men in the gym cause I’m there for the gains not them🤣 https://t.co/sLU1bhTNiE
1425142447789678594,2022-04-11 18:22:15+00:00,1513583221698486274,en,1,1,0,0,1.5134800135758275e+18,,"No…Sorry, I don’t want be harassed https://t.co/QkynVkUWYn"
405133506,2022-04-10 20:01:30+00:00,1513245808715513856,en,1,0,0,1,1.5129365478254264e+18,,I am so sorry you are being harassed by unhinged racists! This country has certainly gone downhill in the last few years. https://t.co/IGpdAGbnOA
557483649,2022-04-10 17:44:17+00:00,1513211276956246020,en,30,0,1,3,1.5129779268196188e+18,,"This is disgusting behavior and I’m so sorry you can’t feel safe on the metro. Please know, I would’ve intervened and there are people in the world who would not allow you to be threatened and harassed. https://t.co/0sk7jcA9uS"
1371554709387943936,2022-04-09 15:55:35+00:00,1512821533747683341,en,6,0,0,0,1.5127191645108183e+18,,"I'm so sorry that this person was harassed over pixels and also, due to a ""bad written"" tweet. https://t.co/GvPCvPW8M9"
1416522409021161473,2022-04-09 14:27:34+00:00,1512799383951183882,en,7,0,0,0,1.5127191645108183e+18,,Don't let antis silence your voice. I'm sorry you were harassed. It's terrifying to do/say the unpopular thing. But do what's right...even if it means standing alone. You were standing for artistic freedom and if you believe in that don't let anyone sway you. https://t.co/l4rPLkIzjE
1153343890323173378,2022-04-09 11:42:45+00:00,1512757906688512002,en,0,0,0,0,1.5125701267841556e+18,,I’m sorry but Nikki Minaj celebrating the demise of this show is chilling as is the fact her super fans are willing to overlook the FACT her husband was charged &amp; served time for a sexual assault related offense &amp; she has since been harassed because of the incident is disgusting https://t.co/EgqoKiRMot
893997494,2022-04-09 04:39:12+00:00,1512651319403634688,en,2,0,0,0,1.5121423758498038e+18,,one time this lady asked if she could have my window seat for her toddler and I ofc said sure but then she sat in the window seat and slept the whole flight while her kid harassed me from the middle… last time I ever do that even if I’m an asshole sorry https://t.co/w2ymUMCnqs
65998330,2022-04-09 04:31:21+00:00,1512649344276594689,en,2,0,0,0,1.512300815549186e+18,,"To the random Asian man this fool harassed: “I’m so sorry, but I have a feeling karma is handling him. He got egg on his face” #racistliberals
#NewOrleans https://t.co/w8zvtIr3lb"
3613326564,2022-04-08 09:18:26+00:00,1512359200890179586,en,0,0,0,0,1.512289804930601e+18,,I feel sorry for you tho coz the fandom  really have to begged &amp; Harassed the brands to get something for their fave. 😂 it must be hard for you guys https://t.co/gwBEe53zt6
1486744417851609092,2022-04-07 20:23:31+00:00,1512164187514052614,en,1,0,0,1,1.5121031113846088e+18,,"I’m so sorry you are being verbally harassed. I haven’t been harassed so far. I’ve had some smart asses make dumb comments. I just ignore, report and block. https://t.co/EOxX41MADz"
926819790198472705,2022-04-07 13:33:05+00:00,1512060897774256130,en,6,0,1,0,,,"I'm sorry but I have to say I'm really disappointed in you. That man harassed the boys unprovoked, he demeaned them as artists and questioned their integrity while unleashing his racist minions upon them. He never seriously apologized I'm sorry if you idolize him but he's vile + https://t.co/iGD9s0qbeI"
1059484693,2022-04-07 11:31:48+00:00,1512030376037912579,en,0,0,0,0,1.5114267462806692e+18,,"Once, I was sexually harassed at a bar in front of my friends and gf, days later I told my gf I’m still mad about it and all I got was “I bet I’m sorry” https://t.co/qy37jX9Rmm"
4404817100,2022-04-07 02:43:41+00:00,1511897471873548288,en,12,0,5,0,,,I feel sorry for the girl though..I think she's being harassed esp. by the other breed https://t.co/DnWQaA2rYd
1094279806382948357,2022-04-06 15:14:19+00:00,1511723985515462662,en,8,0,1,1,1.5117004642823578e+18,,I’m sorry you had to go through such . This happens to me too and I feel so harassed. This is honesty disgusting behaviour and I don’t understand why men think it’s okay to do such . What goings on in their minds .. people sick outchea https://t.co/ZBuYY02Qoi
1423732823626764289,2022-04-06 00:31:47+00:00,1511501890554667011,en,4,2,0,0,1.511486509597487e+18,,// ive muted this so sorry if i dont answer some peoples questions. im just tired of being called the r slur and being harassed by ableists. https://t.co/u6SaCR05bI
1307539481290067968,2022-04-05 22:26:22+00:00,1511470327381037060,en,11,0,1,0,1.5114654381561897e+18,,"As someone who was being harassed by the same person I appreciate you Tofu—I’m sorry you got pulled into the whole mess tho 🥲

I just hope you know I would die/kill a man for you 💜💜💜💜💜💜💜💜 https://t.co/YuUMCrz42T"
1203481690565300224,2022-04-05 14:54:31+00:00,1511356616666656774,en,1,0,0,0,1.5111792983500636e+18,,Girl I'm sorry what you went through but please stop PROJECTING your experience to others. It's clearly part of the SKIT. She wasn't harassed IN.ANY.WAY. https://t.co/4DM0a0pzIT
800142017523159042,2022-04-05 04:14:17+00:00,1511195495489757187,en,19,0,5,0,1.5100930294740296e+18,,"I come back and the 1st new quote tweets I see are by Ricky Berwick &amp; Keemstar ☠️☠️☠️☠️

Regardless of what your stance on this is, I do lowkey feel sorry that this person's probably been getting harassed because of the tweet https://t.co/ZO9ZwEC6BG"
3344826912,2022-04-05 01:37:00+00:00,1511155913763311616,en,0,0,0,0,,,"I'd really like to say ""fuck you"" to all the people who harassed Kimber Lee over the weekend because her abuse wasn't the neat and clean stereotype they demanded. And to Kimber, if you read this- I'm so sorry. I believe you. You deserve better. https://t.co/NxL6830Sbx"
1438707263737315337,2022-04-04 21:53:38+00:00,1511099700954513412,en,2,0,0,1,,,"⠀

   ☾ ; I am so so sorry about coming out of nowhere but that person is sick af and has harassed many people in the OW and persona fandom. Including me 

⠀ https://t.co/kMlxKYyFiQ"
104732199,2022-04-03 20:21:43+00:00,1510714181196005378,en,8,1,5,0,,,"Next this person will want all my personal information to prove I'm real...sorry my Facebook account is private, I don't want my family and friends to be harassed. https://t.co/pzTfRGi9bc"
1315786716645654531,2022-04-03 15:56:55+00:00,1510647541695660045,en,67,3,3,4,,,"lesbian being targeted ☠

they made the decision to cover up the dnf flag with the lesbian flag, and when ppl tried to get the dnf flag back ppl made the narrative dnfers are lesbiphobic, how does that make sense

I'm sorry ppl got dts but the other ppl got harassed too https://t.co/jtdzUk5iTV"
1044659741362872320,2022-04-03 02:00:19+00:00,1510437006752423938,en,0,0,0,0,1.5103601562945044e+18,,"I am just going to say it. I think he he deserves to be back on the field. Am sorry but if we are looking the other way as fans over a man that possibly sexually harassed women or some of those other players that beat there wives or GF, but we say no to a man that protest. 😕 https://t.co/s2XvRm1sAW"
1196065137981108224,2022-04-02 15:03:55+00:00,1510271816199290886,en,69,0,11,1,1.5098266602789765e+18,,"It has been zero days since I've been harassed about how I look. 

Sorry that some of you feel so uncomfortable in your own skin that you hate to see a woman who is comfortable in hers

It really is your problem, not mine https://t.co/qx8v4tdGU4"
1576363579,2022-04-01 22:05:34+00:00,1510015540508696582,en,29,0,1,3,1.509705690419409e+18,,"This is disgusting. No one should be harassed like this. I’m so sorry that this happened in the Japanese side of FS tiktok.

Please remember that this does not reflect on all Shoma fans! Most of us respect and love Yuzuru as a skater!! https://t.co/DOTfiM82b5"
762434606,2022-04-01 07:21:06+00:00,1509792960254136326,en,6,0,1,2,,,"This is what happens when gender inequality issues are raised. In sports,DV or sexual abuse.Those who go through it is harassed further by Men who aren’t brave enough to given equal rights for women.very sad. So sorry if I’ve caused harm 🙏🏾This is Why the cycle continues 😔 https://t.co/XXAvdWZd8t"
1126936825497575424,2022-04-01 05:31:08+00:00,1509765285305364485,en,5,1,1,0,1.509666127441326e+18,,"THE TRUTH ALWAYS COMES TO THE FUCKING LIGHT , I banned him out my chat for this same shit and he harassed me on Instagram! Kept calling me even with the acknowledgment of knowing I wasn't gonna answer . Learn to respect people ! @a1jazz I'm sorry you had to go through this love https://t.co/b3V0RgBU2E"
811546283538317316,2022-03-31 16:48:22+00:00,1509573328159358980,en,0,0,0,0,1.5093556196183654e+18,,"I am so very sorry… close friend of mine, now deceased, told me same story, it hurt him all his life… That was in 70’s… it IS RIDICULOUS IN 21ST Century! My niece is gay, &amp; harassed @ college 14 yrs ago, so much she began cutting. She stayed with me 1 1/2yrs her Mom angry🏳️‍🌈 https://t.co/Kgu4FSfdrn"
55219878,2022-03-31 05:31:23+00:00,1509402959951831043,en,0,0,0,0,1.5092984688920658e+18,,"I'm extremely sorry this happened to you.
Dear fellow men, I know the hesitation to act when a woman is being harassed is daunting. We are in a slumber and hushing it up seems like the right thing to do. But it's not. We need to speak up so the woman passenger feels safer. https://t.co/153HQZqifV"
1499564133167075330,2022-03-30 16:46:38+00:00,1509210505067515913,en,1,0,0,0,1.5089853679698289e+18,,That is so sad. I’m sorry for those who got harassed ❤️ https://t.co/kk5JNREBSy
1247580079665713153,2022-03-29 23:47:41+00:00,1508954074473201665,en,0,0,0,0,1.5066809716465787e+18,,Pangitain na pala to. You were verbally harassed. I'm so sorry you had to experience it. 😞 https://t.co/2LwAOuEvA6
42172376,2022-03-29 07:23:14+00:00,1508706330835517441,en,0,0,1,0,1.508247551450919e+18,1.5084939965233562e+18,"If you guys are curious about the context, this is it.

I don't care if it's scripted. If you think a joke about men getting harassed on a stage is funny, I feel sorry for you.
https://t.co/gNgpKPPtMb"
1159314399556861954,2022-03-29 06:33:04+00:00,1508693705267740672,en,0,0,0,0,1.5082716512212173e+18,,"Problems of having the same name as someone in news! 😂 I'm sorry bruv, I heard you were being msgd and harassed, thinking you the fresh Prince! Rather you are the forever fresh King! https://t.co/DDtCXnxjts"
1137243419259080705,2022-03-28 23:32:10+00:00,1508587783350362114,en,6,0,0,0,1.5083756778835886e+18,,This is prt of why I take care of infants. I could not do what all of you who take care of adults do. I’m extremely grateful for all of you and I’m sorry that you most likely get sexual harassed on a regular basis. https://t.co/YAIjbNjxjC
1488324657744945154,2022-03-28 14:24:55+00:00,1508450064640921608,en,0,0,0,0,1.5082716512212173e+18,,"I know you are just getting harassed, luv. I’m so sorry 😭 https://t.co/P4gAAW1AsM"
2176765463,2022-03-28 11:57:51+00:00,1508413054287024133,en,3,0,0,1,,,"Oh no,that’s horrific and of course goes as unpunished as their mobs threatening H&amp;M employees,Clicks&amp;Vodacom employees,parents in front of schools,harassed restaurant owners. I am so sorry that happened to you😢Why was there no public outrage,no media coverage😡 https://t.co/hmbyr5EurD"
1482880969023578133,2022-03-27 21:15:12+00:00,1508190928363790342,en,0,0,0,0,,,"I feel so bad about this, if the situation was reversed and a lady was the one on stage people would have been ready to fight.Hashtags about female sexual harassment would have been trending but y'all men can be harassed too. Sorry rugar https://t.co/gwXxVbVfG7"
1123747333299212288,2022-03-27 04:17:03+00:00,1507934699154464768,en,0,0,0,0,1.507929679239385e+18,,yeah i’m not ignoring the fact that a black woman is being target and harassed sarwiii not sorry https://t.co/23BP3G8rbc
2661602502,2022-03-26 20:51:01+00:00,1507822453254500352,en,0,0,1,1,1.5078074658276188e+18,,"Sorry, I used up all my empathy on female athletes being cheated, detransitioners, wives of AGP men, women held in prison cells with intact rapists, truthtellers, whistleblowers, and harassed lesbians. I am all out of empathy for (checks notes) porn-addled straight men https://t.co/tj79qu5y25"
1380944627021266945,2022-03-26 18:09:55+00:00,1507781911489523715,en,7,0,0,1,,,Sorry but i would never defend his bullies. They harassed a lot of people in this fandom. https://t.co/oJkKvjpK0V
1247617219477020675,2022-03-26 15:52:25+00:00,1507747309613944841,en,9,0,2,0,1.5077468685701202e+18,,"Some canceled cannot be redeemed I am sorry to say. Not if they messed with minors, sexually harassed people or even going as far to SA someone. I am sorry. https://t.co/6O0L1EoTPi"
824213791,2022-03-26 11:27:32+00:00,1507680648361775104,en,4,0,0,0,1.5075974250530324e+18,,Let me start off by saying i have no clue who this guy is or that this was going on. The gc in which i asked this was created by a friend of mine who threw a bunch of us just into a gc for fun. Having said that. Please stay away from this man and to anyone harassed I am sorry :/ https://t.co/Fd3QkmcBmA
2537890130,2022-03-26 05:41:39+00:00,1507593604159750144,en,0,0,1,0,1.5075916347997676e+18,,"I was gonna tell the story about how I accidentally harassed Matt Thiessen on Facebook once as a teen but there’s been a Relient K podcast following me for like 2 hours they’re gonna know too much I’m sorry Sadie Hawkins Pod

Also it’s very embarrassing and not quite accidental https://t.co/To6osbYIna"
818798402,2022-03-26 00:32:36+00:00,1507515828769492996,en,0,0,0,0,1.5075082758095954e+18,,"Sorry to hear your being harassed. I do hope you have a good day. Everyone's horny sure, but a nice conversation can be nice too. https://t.co/KtNa8VPgX8"
446957267,2022-03-25 23:52:39+00:00,1507505774129385472,en,1,0,0,0,1.507504446720426e+18,,"A reminder that it's NEVER okay to harass game developers, or really anyone for that matter. You never know what people are going through. Just be kind to each other; It's not that difficult. 😊💜

As an aside, I'm sorry you've been getting harassed for nothing, @DavidEllis. 🥺💜 https://t.co/N116HsW0YA"
1108577120895320065,2022-03-25 16:51:11+00:00,1507399711208185885,en,7,0,0,1,1.5071347175097917e+18,,sorry but all i have seen so far is a) stand berating her for shit that was totally out of her control and b) people using the whole thing to justify being racist towards her. valid to be upset but artists are allowed to have human reactions to being harassed. https://t.co/vIY9G2cYz7
1221576330,2022-03-25 00:58:24+00:00,1507159935280422912,en,0,0,0,0,,,"@Lesdoggg Hi Leslie, If I Blocked And Muted Someone You Are Friends With, I Am So Very Sorry. I Should Not Be Blocking Anyone. I Should Only Block Someone If They Are Harassing Me. No One Has Harassed Me. https://t.co/bdKsQ9I8bt"
1315136941776605184,2022-03-24 19:57:39+00:00,1507084247940702210,en,5,0,1,0,1.5070487039280292e+18,,"child: i'm being harassed online by adults!! please help
adult: okay, i'm sorry you're feeling upset/nervous/etc. do you mind letting me know what happened?

this is driving me bananas because it doesn't take that much nuance to see accountability and safety can go hand in hand https://t.co/0uauJSHSbA"
772019482139111424,2022-03-24 12:46:47+00:00,1506975814273073155,en,0,0,0,0,1.5066498359899873e+18,,I am sorry. No lady should be harassed on public transport &amp; roads or anywhere else. https://t.co/2TPMDeZIAg
1385246081143898120,2022-03-24 09:54:23+00:00,1506932428933574657,en,3,0,0,0,1.506862750114345e+18,,I’m sorry but at which part did you feel like you’re being harassed? https://t.co/iCwvoSvl6O
832395410631061504,2022-03-24 05:19:40+00:00,1506863296753766400,en,0,0,0,0,1.506632289287086e+18,,"I'm sorry, but you seem small minded.She knew, and you know it. She was tired of being harassed, and I'm sure she intuitively sensed it'd be useless to respond to the intended belligerent request. https://t.co/ad5jwdp84Z"
897752384541257728,2022-03-23 14:57:37+00:00,1506646353493037067,en,6,0,1,0,,,can someone inform whatever school this person is working at about this tweet because i feel so sorry for kids that will have to deal with a 23yo pr0shitter south park fan who doesn't believe children when they say they're being harassed https://t.co/pAL51IT0G8
20010113,2022-03-22 02:42:25+00:00,1506098946166329350,en,0,0,0,0,,,I am truly sorry that you + your colleague have been harassed. Students who’ve violated BYU’s honor code can (should) face consequences. But? Copyright? Isn’t taking course material excerpts w/o permission for criticism expressly allowed as “fair use”. https://t.co/RHIFHNTozr https://t.co/8KDpqeySk6
21985389,2022-03-21 20:59:33+00:00,1506012663054495745,en,1,0,0,0,1.5060078985684296e+18,,"Read this thread. 

Also, I’m so sorry that a person who should have protected you harassed you.

Also, we need more women in game dev so that we can tell these stories without fearing that _all_ women will be painted with the same brush. https://t.co/W6PqPH6XBE"
