author_id,created_at,id,lang,public_metrics_like_count,public_metrics_quote_count,public_metrics_reply_count,public_metrics_retweet_count,quoted_id,replied_to_id,text
1215105987616501762,2022-06-30 20:32:15+00:00,1542606965288734721,en,131,4,20,27,1.542582772056957e+18,,"Another day, another god damn Ezra Miller story. Whether this is true or not, it is very clear this person needs severe mental help. 

I feel so sorry for all the victims who are constantly getting bothered &amp; harassed. 

As for THE FLASH film … It’s DOA. https://t.co/Ns22l1Y0Pn"
1416232758381264896,2022-06-29 21:15:38+00:00,1542255493481172994,en,0,2,0,0,1.5422551115185275e+18,,normalize letting your favs know about you getting bullied and harassed by fellow fans. i got receipts. 63 screenshots to be exact. i’m sorry some of your fans did this @HAIMtheband @jizziemcguire https://t.co/GyVeuvqkFe
948211145009238018,2022-06-29 11:52:47+00:00,1542113848920088576,en,7,0,0,3,1.5420445710807368e+18,,"%100! Vegas harassed Porsche twice,manipulated &amp; gaslighted Tawan for years just to hurt Kinn,made Pete lick the floor just for his sadistic urge. Now do I have feel sorry just because his dad is dumb*ss and his hedgehog died? F*ck the hedgehog(also the dad)
#KinnPorscheTheseries https://t.co/oCUE0mTO22"
1380542405112258561,2022-06-29 09:28:51+00:00,1542077627447406592,en,1,0,0,0,1.5416046817591337e+18,,its not an opinion if its incorrect. and when people tried to correct her she just refused to even acknowledge their words. like i am sorry but if you are gonna start the drama u will get harassed about it (i am not supporting it but thats how the internet is) https://t.co/0xoPXl7tGs
838809438249091072,2022-06-29 05:07:51+00:00,1542011945980956672,en,147,2,2,12,1.541979333014995e+18,,"those who are saying satirical antisemitic jokes (which are not even aimed at jewish people) are still not OK, but are okay with ironic homophobic and transphobic jokes, spare us your hypocrisy? I'm sorry the artist is getting harassed. https://t.co/4T0SwZOFyT"
1214238610704060416,2022-06-29 04:39:25+00:00,1542004788346228737,en,13,0,0,1,,,"It's incredible how much you are obsessed with him just bc you think his comic is cringe.
All of the other bullshit you have either made up or stretch it to unbelievable levels even though he apologized ages ago.
I am so sorry to see a queer artist being harassed in this way https://t.co/3unpJR9aWy"
1420259199301439490,2022-06-28 15:52:15+00:00,1541811723467890688,en,0,0,1,0,1.5417776034341028e+18,,he was stalked and harassed all weekend long and y’all want him to wave and say hi after an exhausting flight?? no one told y’all to go to the airport maybe now you’ll actually learn. sorry you’ve been treating bts like they’re not human i hope this is a reality check for you https://t.co/PnEru0wGYc
430801666,2022-06-28 08:33:09+00:00,1541701223098859521,en,0,1,0,0,,,"He dmed me yesterday stuffs like: ""i'm not gonna harassed you anymore. I'm sorry i know i were creepy"" 

And here we go again :)))) please reported him. https://t.co/Wgjiyhfu9H"
1137640604970577920,2022-06-28 04:00:54+00:00,1541632706890633216,en,0,0,1,0,1.5416313408897065e+18,,"""A-Anyway...""

Recalling the previous situation, Yuni flitted her gaze upwards. Subconsciously rubbing her pointer index onto the ground, she will build up the courage to say- ""... I was- just harassed recently. So I'm sorry i-if I lash out at you o-or upset you. I was really ─ https://t.co/vwA0zEG5H8"
1314429882969935873,2022-06-28 01:19:42+00:00,1541592141495169024,en,6,0,1,0,1.541369983317336e+18,,"So far it’s my foreign husband got harassed in the past, we haven’t got children, and i can’t imagine the nightmare, really sorry for you https://t.co/hxChtFDync"
818800320386072576,2022-06-27 23:37:34+00:00,1541566438678450176,en,1,0,0,0,1.5415648640861716e+18,,There are very few women that I know who have not been raped or sexually harassed. But every time a woman shares her experience with me it breaks my heart. I'm sorry that this happened to you. https://t.co/Uw7BQrUxuN
115556928,2022-06-27 18:24:12+00:00,1541487577617895425,en,4,1,1,4,1.533817724626944e+18,,"Women/-identifying journalists who have been sexual harassed/assaulted: I'm sorry for what happened and I hope you will share your story. Hoping to speak to Black women, women of color, queer women. See below and thank you. @NABJ @NAHJ @najournalists @nlgja @aaja @womenjournos https://t.co/yTaQkl030A"
2319884434,2022-06-26 16:54:15+00:00,1541102554205114369,en,0,0,0,0,1.54059530782575e+18,,"I understand the feeling 100. To be honest it doesn't go away easily.. I was scared for months at seeing a Hilux even in a safe environment after being picked up and harassed. Take the time you need, I'm sorry this happened to you tho https://t.co/xfG7Vfi1cy"
1176767154,2022-06-26 16:15:32+00:00,1541092808991412225,en,0,0,0,0,1.5410743623461437e+18,,"But THIS is a thread celebrating her landmark book which ignited a passion for reading in millions of children. It has NOTHING to do with RvW. I'm sorry but if this is your first foray into this, you need to know that she is harassed and gets gang rape threats 24/7. It's sick. https://t.co/5jbgSlRO00"
852503916294090752,2022-06-26 06:40:21+00:00,1540948060729233408,en,0,0,1,0,1.5401619198515405e+18,,"I'm really sorry origins turned out this way.
Sega needs to know when to just let people finish games.
And I'm sure you're being harassed by stupid man-children in the sonic community despite origins' problems not being on your team or you and you guys don't deserve. https://t.co/CMzt6YMYmR"
1356665419625418753,2022-06-26 04:21:10+00:00,1540913031269318656,en,1,0,1,1,1.5409106832016998e+18,,"/ no way yiggs both treated us like shit just bc we huwt his widdle feewings? 😱

nah but fr that shit low af. sorry you had to go through that too, i’m sure as hell you don’t deserve getting harassed just bc you didn’t reciprocate his feelings.

and DEADASS, he’d constantly + https://t.co/ftItBFVvVb"
1484047927089799171,2022-06-25 07:39:05+00:00,1540600451548200961,en,12,0,0,1,,,Look what you all did. To all the people on anitwt who went about and harassed other users for absolutely no reason you are not ok and I feel very sorry for you get help https://t.co/9824F7p806
172093866,2022-06-24 05:53:28+00:00,1540211486831677440,en,0,0,0,0,1.54016747247659e+18,,A man said “hi” to me at like 9:30 pm last night at the dog park while he was walking by but I just couldn’t respond or make eye contact bc every time I’ve done so in the past I’ve legit been sexually harassed. Like sorry dude maybe you are just being nice but can’t risk it https://t.co/fzWgHOKLxg
593813785,2022-06-24 01:50:47+00:00,1540150412388474881,en,3,0,0,0,1.5401126196751974e+18,,"Sorry, but I'm not so sure redemption is possible after @speakerbowers told @January6thCmte how Trump &amp; his domestic terrorists harassed/threatened Bowers &amp; his family when his daughter was dying, and yet, Bowers - knowing what he knows - said he'd still vote for Trump in 2024.🤯 https://t.co/bkES4H0KFA"
779142683658952704,2022-06-23 17:23:18+00:00,1540022701473030151,en,0,0,0,1,1.5386474263488594e+18,,Hi Adam I’m sorry that you and your family are being #Harassed and #Threatened for the #BigLie I also want to #ThankYou and the other #Committee Members for #Standing up for #Democracy https://t.co/vucrhZWQqT
1082443865657880576,2022-06-23 14:24:42+00:00,1539977751750275073,en,1,1,0,2,1.5399760833651753e+18,,Press showed what was occurring stated Chief Whip was looking for Leak considering contacting police.Grady Sexually Harassed employee why didn’t SNP not think of reporting it to police.I feel sorry for victim&amp;6yrs pressure hes suffered made worse Robertson&amp;Blackford backed Grady. https://t.co/DYFMlZfpR2
1155306460739489794,2022-06-23 12:41:58+00:00,1539951899226546177,en,0,0,1,0,1.5397246243883172e+18,,The amount of entitled people angry that private profiles remain just makes me wanna keep my profile private. Sorry that I don’t feel like being harassed by a bunch of fucking dickheads over a goddamn game. https://t.co/SPZZBjfx51
1231934245381099521,2022-06-23 03:09:45+00:00,1539807895113502721,en,0,0,0,0,1.5396145661071933e+18,,my ex bsf told their gf to tell me that they miss me and i was like 🤨🤨🤨 no sorry i can’t be friends with them no more like did they forget the harassed me multiple times https://t.co/SxiSSa4qPY
342987607,2022-06-22 19:59:27+00:00,1539699607126609920,en,1,0,0,0,1.5396602215888527e+18,,If Marc Elias is defending him then there is a grave mistake in this accusation. I’m just saying. Elias is the best. I am sorry he’s still being harassed. https://t.co/vmqMh9YMyh
951514269832507392,2022-06-22 16:20:44+00:00,1539644565711638528,en,1,0,0,0,1.5396165059853926e+18,,"If 875 comes to switzerland and holds concert I hope they never get concert tickets. Sorry not sorry but any european ""fans' who harassed him during his vacation I hope you never get concert tickets or money to buy merch/albums https://t.co/bEjGHgezX0"
867219420489371648,2022-06-22 11:35:29+00:00,1539572781851054080,en,6,0,1,0,1.539219557285503e+18,,I’m sorry that I don’t care that a boy was ostracized for spreading a girls nudes especially since I grew up when girls would be bullied and harassed for having their nudes leaked now that the tides have turned adults care?? https://t.co/SARZ9YsgBA
2970314067,2022-06-22 01:27:22+00:00,1539419742800330752,en,0,0,0,0,1.5393295131500298e+18,,I am so sorry that they were so harassed! https://t.co/q5gECQwvka
97679902,2022-06-21 16:17:37+00:00,1539281394744041474,en,1,0,1,0,1.539274333041877e+18,,"“Here is a million dollars. Sorry i sexually harassed you but keep your mouth shut”

This man is literally Jeffrey Epstein 2.0 https://t.co/4WQPbJmQg2"
870860456411484160,2022-06-21 08:10:34+00:00,1539158822471745536,en,0,0,1,0,1.5204523730550006e+18,1.5388817759712215e+18,@JohannaMellis @Nathan_Astbury Hi Johanna I'm sorry you are being harassed. There are signs this is part a troll farm  that took over an inactive account. I found this thread helpful re dealing with trolls/ catfish: https://t.co/olNeyUg3F6
821063726015148033,2022-06-20 16:28:00+00:00,1538921618893856771,en,1,0,0,0,1.538901113050628e+18,,"The root of this is me defending someone who mothered me during times my own was absent. I’m not sorry for it. I don’t have a mom.
I grew up in the trenches of the Middle East &amp; then was trolled/harassed/cyber bullied the rest of my life by Israelis through CM I’m used to it tbh https://t.co/4AhJtqLfZL"
1144239871139176448,2022-06-20 15:45:41+00:00,1538910969061072902,en,1,0,0,0,1.5377914875172823e+18,,So I’m  very late to this because I only found out this cause I was mutuals with someone being harassed but this sick head and got blocked cause I followed this asshole (I don’t even remember how I followed them) . So I’m sorry for that . But anyway your full of shit Kiyomi. https://t.co/85xhgzLWAU
1091590841917816832,2022-06-20 13:20:10+00:00,1538874348043653122,en,0,0,0,0,1.538746168142082e+18,,"sorry but sometimes bully accusations are so funny cause i can just snap a photo of any celebrities yearbook and literally said they bullied, harassed, committed a crime, cussed and anything possible

Just with that yearbook https://t.co/ESz7tLcXnf"
1041702760083730432,2022-06-19 23:21:42+00:00,1538663344126799872,en,134,0,20,9,1.537949130277892e+18,,"Sorry, but I think getting paid for being hot in the safety of your own home is WAAAAAY better than busting your ass to live paycheck to paycheck just to get sexually harassed anyway by strangers, coworkers, AND management on a regular basis 🤷🏼‍♀️ https://t.co/oKJZ9UXIiJ"
1277926005663916035,2022-06-19 20:51:29+00:00,1538625538213875713,en,1,0,1,0,1.538619966072664e+18,,"""Well women get harassed bc they just dont mute and ignore"" sorry that i cant ignore the fact im getting called a whore both irl and online while you get to jack off in your moms basement and still be praised, my apologies https://t.co/lT1XbqGOZ9"
1326489046026244096,2022-06-19 11:50:25+00:00,1538489376639967232,en,0,0,1,0,,,I'm sorry for saying they sexually harassed him those two times. Women are totally free to drag his balls and fry it with yam if they wish. https://t.co/Bsw5i4iI5o
1499225186553548800,2022-06-19 03:37:39+00:00,1538365364786147328,en,3,0,1,0,,,"I'm sorry Juriko, I'm not close to forgiving you, any time I was, you fucked it over by sending my friends porn for no reason, harassed my friends for no reason, and used my shit without my permission for your own self esteem. I'm more than willing to hear ANY reasons you got for https://t.co/KNibF437PE"
298748241,2022-06-17 08:46:59+00:00,1537718435647717376,en,19,0,1,7,,,as someone who has gotten harassed on the bus and stopped using it - i agree with this. sure that’s not a solution to the root problem but i’m sorry i can’t wait without using public transport until people stops being shitty &amp; this problem gets solved. https://t.co/bWFPSAqFQh
1104240984941051905,2022-06-17 02:23:42+00:00,1537621981088165892,en,1,0,0,0,,,"Sending some love out to this dude.

He's (more or less) being harassed at his Uni because of his (outright milque toast, sorry mate) opinions on twitter.

I encourage everyone who cares about academic freedom follow @tuttleryandavid and show him your support. https://t.co/zZMtgR7VcG"
1320116274714869761,2022-06-17 00:48:06+00:00,1537597923667632128,en,0,0,0,0,1.5375756679565804e+18,,"This. Sorry but no, Crowe. Anyone who stands up for someone who silences women who were being SEXUALLY HARASSED is getting the unfollow. No time for that shit on my timeline. Don’t let the door hit you on the way down… I mean out. https://t.co/KkjTFjwqRl"
2355595164,2022-06-15 07:32:55+00:00,1536975023885279232,en,1,0,0,1,1.536852583733678e+18,,"Yes! I’ve been bullied, harassed,victimized, beat by officers many times. Hard to feel sorry for them when something bad happens https://t.co/xnfhQpc2Ho"
1099693976,2022-06-15 02:24:24+00:00,1536897381631143937,en,185,0,12,25,1.536894862427054e+18,,Exactly. A Bitcoin maxi yesterday called me a legal parasite because of a tweet on the lawsuit. I ignored it. I did not feel humiliated or harassed. I did feel sorry for him though as he needs help. https://t.co/VRel7rafd3
1482773510762242049,2022-06-14 08:50:18+00:00,1536632108654940161,en,50,0,1,3,,,"Thank you Cokos. I know it isn't easy to apologize properly (I've received TONS of apologies in DMs; meanwhile, the stuff they're apologizing FOR was all public and led to me being harassed, so...). I do appreciate it, and I'm terribly sorry for what your team had to experience. https://t.co/G0NNXQfblt"
1120148808430686209,2022-06-13 19:49:50+00:00,1536435696734461954,en,23,0,3,0,1.536377393669374e+18,,I’m getting shit for this and I get it but I was trying to call out hypocrisy more than body shame someone like don’t dish what you can’t take sorry. He also literally sexually harassed me and was bullying me in dms? https://t.co/2soaF7TcCd
292057235,2022-06-13 16:34:27+00:00,1536386526996615169,en,13,0,0,0,1.5363658973587456e+18,,"While I am sorry to see this, I am not surprised.
We’re in the magical thinking moment. Masks are rare. Those who wear them are harassed.
Expect to see more such announcements, contrary to all those insisting we’re “back to normal”. Normal was never a good standard. https://t.co/xNgn84moMb"
327697369,2022-06-13 12:53:13+00:00,1536330853890105344,en,3,1,0,0,1.5362834929585807e+18,,"Sorry to read this. but you are lucky you got off so easy. I continue to be harassed today by @APA loyalists who kicked me off SSCPnet for criticizing psychologists' involvement in enhanced interrogation, AKA torture. https://t.co/Syulr9pDqb"
2883843686,2022-06-12 00:09:52+00:00,1535776362585374727,en,0,0,0,1,1.5352871507232276e+18,,"I""m very sorry you're being targeted, harassed, and censored, are you ok? Also is your agent or you documenting the handles, the account IDs hun? https://t.co/ZWihCHmzkx"
1066289999534940160,2022-06-11 13:44:45+00:00,1535619044082356225,en,3,0,0,0,,,It's really alarming that most of my friends got sexually harassed and they've been hiding it for years. It must've been really hard and traumatic for them. I'm sorry for all of you who experienced this. I support you in your healing process. https://t.co/5BG6a4dd53
2192098397,2022-06-11 03:50:01+00:00,1535469376295559168,en,59,1,3,13,1.5353801539241452e+18,,Thank you Jim. This is exactly what people in this fandom have been saying for months to that SaveMLP guy. I’m terribly sorry that you or the other cast and crew members have been harassed by him and his asinine campaign. https://t.co/5tt7uilfQl https://t.co/7rFUFbMrHd
1279497892722610181,2022-06-11 00:58:20+00:00,1535426171474792448,en,4,0,1,2,1.535336129720877e+18,,Really sorry this motherfucker harassed u and is a straight up white supremacist. Wtf? I'm really just here to talk abt movies and shit...I'm so sorry this happened. Came across their @ hours ago after I quoted a tweet and wondered where they went. Now I know... https://t.co/hQ2iayjmmg
2989249962,2022-06-10 05:36:41+00:00,1535133832231403520,en,118,0,13,10,,,i'm sorry but i just can not trust him. he's harassed other artists besides me. i don't want this to keep happening. his actions aren't of someone apologetic. you can't treat someone this way and then act all surprised Pikachu when they speak out. i've held off for a long time. https://t.co/66jASQAY13
1186071566054035457,2022-06-08 20:18:30+00:00,1534630971097628673,en,15,0,0,0,1.5346288461331988e+18,,"I'm sorry because I have friends who have the tag and I'm trying not to sound jealous.

But it's bullshit that LGBTQIA+ streamers (esp. queer PoC and trans steamers) get CONSTANTLY HARASSED on Twitch and aren't even afforded an opportunity when Twitch actually pretends to care. https://t.co/JpK7bYdYHQ"
2988771178,2022-06-07 19:51:30+00:00,1534261789130641408,en,0,0,1,0,1.5342604703365243e+18,,I am sorry I have several friend black and white.  When we are out  with guns no one get harassed or shot.  It is how you are either law abiding or a thug.   Now you may run into poor police officers but I have never seen the level of issue with my black friends that you speak of https://t.co/YkfOFTvjae
1331369342374719498,2022-06-07 14:31:58+00:00,1534181377477857282,en,3,0,0,0,1.534140919162839e+18,,"This is horrible. I'm sorry @grasshoppervoy, @fbeeei and anyone that has been harassed and threatened by that awful people. I stand with you💛 the FBI fandom has no place for bullies https://t.co/VZxYxfpy7w"
1246104418648330241,2022-06-07 03:25:11+00:00,1534013576540606464,en,0,0,0,0,1.5338051100482068e+18,,"tw // sexual harassment 

I’m so sorry to hear that Kak, hope both of you esp your bf are safe

When ppl said sh can happened to both gender, it’s fckn real! Woman or man, the probability of both might differ, but it doesn’t erase the chance of them got harassed 😭 https://t.co/EBuplZ2S6G"
914101676688191488,2022-06-07 00:24:04+00:00,1533967994799460352,en,0,0,0,0,1.5339572356883292e+18,,"It fucking breaks my heart that a game this good is getting harassed by this.

First the serves and now this!? I’m so sorry @VHSTheGame. We love y’all &lt;3 https://t.co/KEWjANqgpL"
106100935,2022-06-06 17:11:30+00:00,1533859135283920896,en,0,0,0,0,1.5334441864558182e+18,,"Every time I check...israel has done it again! Brutality, murder, sadistic beating, homes destroyed...no end to the zioNazi saga! It makes me ill! 

Kids...kids harassed! Kids arrested. I can't take it anymore!

BOYCOTT THE SORRY BUNCH !
And send in an army to clean up!! https://t.co/JReizsuATR"
1519727961527697410,2022-06-05 23:00:37+00:00,1533584607756439552,en,0,0,1,0,,,"Also. ""I'm sorry for making the joke"" doesn't cut it.
I want an APOLOGY. Not some fucking sentences. I want AT LEAST a paragraph. Our mom has been RAPED and SEXUALLY ASSAULTED and HARASSED. I want an *APOLOGY* not for just me. But for her too and it BETTER be publics https://t.co/jJjOlzfjKZ"
814523749173227525,2022-06-05 14:11:33+00:00,1533451464667963394,en,9,0,3,0,1.533261996161962e+18,,"‘Sorry that I sexually harassed someone in your community, but I have a mental illness which means this isn’t a bannable offence’ 🙃💀

If anyone is wondering, no I didn’t unban him https://t.co/BlWjqKEQ40"
309570860,2022-06-05 03:59:21+00:00,1533297395534299136,en,1,0,0,0,1.533276259769127e+18,,"I am so sorry @nandiniv for what happened to you 🥲, is there any safe space for women /girls to travel without being harassed ? 

What can our society do to ensure no mom is ever put in such situation! What will it take to build safe public spaces??? https://t.co/nLUS0Dm2Qj"
231191249,2022-06-04 14:48:31+00:00,1533098376530644992,en,1,0,0,0,1.532795917631365e+18,,Once a year I come across a tweet about @HeatherAntos which reminds me immediately who she is (the woman that was harassed by fake fans for having lunch. And also that she has a cool-in-theory job. But always the first thing first. Peripherally exhausting. Sorry Heather. https://t.co/wfmzLNfeyG
103352407,2022-06-03 11:14:59+00:00,1532682253499002880,en,32,1,1,4,1.5324149172148797e+18,,"I’m getting flashbacks to every time shit like this has happened.
It makes me so livid.
Every woman I know or you know have been harassed in some way or the other.
EVERY woman.
Don’t @ us when we tell you it’s an unequal world.

Raise better men.

Sorry Advaita. https://t.co/pqX7PCaYd8"
3071077238,2022-06-03 04:49:32+00:00,1532585250777628672,en,2,0,0,0,1.5324193788929147e+18,,"I think we have failed yet another woman who stood up for her and got harassed even more by doing so.i was so sure that lama guy was the harasser when he didn't retaliate at all and also said sorry.but instead of supporting Miruna Magar,people started doing nonsensical drama. https://t.co/Y2KpWtFoR3"
611355092,2022-06-03 03:04:21+00:00,1532558778750705674,en,0,0,0,0,1.5324890780878643e+18,,Interesting that the article is written by a Rebecca (sorry to the good ones) but I was harassed and abused by a Rebecca… 😬 https://t.co/vOxPh70L34
631408833,2022-06-03 02:50:47+00:00,1532555365715517440,en,5,0,2,0,1.5325492446657004e+18,,"harassing? mg never harassed lizzie ever… i’m sorry, what even is this tweet? 😭 https://t.co/Iiq7GWLSJl"
1324058887763492866,2022-06-02 18:30:30+00:00,1532429467804651537,en,0,0,0,0,,,I’m sorry I can’t feel anything I’m too busy being a woman and constantly harassed worse than.... a mistake that is your own. Just get it fixed and apologize to YOUR CUSTOMER as you’re trained. We ask for equality cuz I’ve never seen them act like this with a 🦷 person. https://t.co/B8PoQOrs3h
1155234042675003392,2022-06-02 15:43:51+00:00,1532387526480015360,en,17,1,1,1,,,told a close male senior of mine his friend sexually harassed me once and he said 'yeah the whole class knew abt him hes just like that but i dont want to badmouth him cause hes my close friend. so sorry u had to go thru that tho' LIKE????!!!! https://t.co/GrpjaW8AQ6
1371494684154007552,2022-06-02 02:00:31+00:00,1532180326864375810,en,2,0,1,0,1.5321775550039409e+18,,Now this person’s friends are dming me like …… sorry but you guys literally don’t care about abuse victims. I am an abuse victim who is literally triggered by this case and am being harassed because I DARED to speak out against the violence that survivors are facing bc of this. https://t.co/WQn5OMrrUz
1266226053992742917,2022-06-02 01:31:42+00:00,1532173074434387968,en,1,0,0,1,1.5315196539518362e+18,,"We are not Star Wars fans period. But I saw on the news your being harassed with races remarks. Sorry there are such RACIST A-holes out there. You are very beautiful  and harassment, well they're jealous. To hell with them. Glad you are in this movie. https://t.co/ZYfl7UcclI"
1221762667100233728,2022-06-01 07:11:32+00:00,1531896210067492864,en,1,0,1,1,,,Girl I’m so sorry for my cousin’s behaviour and how she harassed you This is embarrassing!💔 https://t.co/0fdExXX077
1343992874548002816,2022-05-30 17:40:12+00:00,1531329645160894465,en,0,0,0,0,,,"I cant tell anyone anymore, Id just risk everyone getting harassed, Im so sorry -Blantados https://t.co/lkqGalO17Z"
556400855,2022-05-29 20:09:20+00:00,1531004788292435969,en,10,0,1,0,1.5309672635320525e+18,,I am sorry you were attacked and harassed. And also you dropped this 👑 for speaking facts. They never gon agree with this cuz it’s a fact and the truth and goes against their own bias’. https://t.co/9ofaDDARJN
35544539,2022-05-29 16:39:58+00:00,1530952097625145344,en,0,0,0,0,,,I’m sorry but this is FUNNY. Lol. I hate you’re being harassed but…..😂 https://t.co/HfVYQqiU5i
395530369,2022-05-29 15:38:08+00:00,1530936538175049728,en,2,0,0,0,,,"and all the people who harassed her and called her a liar are quiet as usual. I’m so sorry this happened to her. Thank God his bitch ass is dead and in hell, right where his ass belongs and can’t do that shit to nobody else https://t.co/aTUOSy4mAh"
900884694,2022-05-29 15:00:40+00:00,1530927107404189699,en,1,0,0,0,1.5309231729456087e+18,,Is this how women feel when they get harassed by men? If I ever did this I’m so sorry https://t.co/hGdw5qKAff
1257659508458786818,2022-05-29 14:11:18+00:00,1530914683938451457,en,3,0,0,0,1.5309014700063457e+18,,"Wtf @fantagiomusic_ your staff is so rude😠🤬😡 your staff could've just ask her nicely not harassing her that way! I feel sorry for the girl
@offclASTRO our Aroha has been harassed please scold that staff😤 https://t.co/0iHHoUBFoF"
