author_id,created_at,id,lang,public_metrics_like_count,public_metrics_quote_count,public_metrics_reply_count,public_metrics_retweet_count,quoted_id,replied_to_id,text
1046171102916038656,2022-03-21 16:29:47+00:00,1505944770593669122,en,10,0,0,4,1.5059418215072236e+18,,"Sorry, can't own up to what CA shippers were doing that time because I was busy being harassed by CTs. I didn't even know CA shippers existed that time https://t.co/F1qMeBGafM"
900159290341638144,2022-03-21 15:23:35+00:00,1505928111204061188,en,0,0,1,0,1.4228908316151685e+18,,"Like sorry that calling out pedophilia is the hill I'm gonna die on. I don't care how profound her words are, I'm not going to shut up about it. 

The boy (now a man) on the cover of her book said he was sexually harassed by adult men and did not consent to being on the cover. https://t.co/EiH5vxats3"
2716368828,2022-03-21 05:33:13+00:00,1505779541545041922,en,0,0,0,0,1.5057724201159311e+18,,"I feel sorry for those TMC workers who were harassed, terrorised and threatened by Babul Supriyo and his team of BJP goons right before and during the Assembly election last year. https://t.co/na6MMJslOp"
52359339,2022-03-21 05:02:43+00:00,1505771865679470598,en,2,0,1,2,1.5056548268891423e+18,,"Mem don't realize how deep of an impression women feel when they are harassed. It might be a joke to you, but it will keep haunting the woman for all her life. 
Please stop your catcalling, eve teasing and harassment. 

I'm so sorry you had to go through this. 💝 https://t.co/Utmn1nRBj0"
379645923,2022-03-20 12:50:06+00:00,1505527097544126464,en,44,0,1,7,1.5051790921147146e+18,,Ffs mate. Stop gloating about putting poor people in the global south in jail. I am sorry you were harassed and I don’t expect any structural or nuance understanding of structures of inequality but this is a young man and he most certainly does not deserve to rot in jail for this https://t.co/dQyerZc62s
2368906765,2022-03-20 00:12:58+00:00,1505336562208358402,en,1,0,0,1,1.505271670067458e+18,,"My Gosh. I am so sorry for all this!! BTW, I already blocked that person who harassed you. His name is Robert something. (Forgot his Twitter account) Anyway, I hope this nightmare is over! https://t.co/m7lyMVm1VE"
1381469097825861634,2022-03-20 00:04:23+00:00,1505334400883605507,en,7,0,0,1,,,"This person doesn't need to be insulted or harassed.
I'm sorry but I don't need my art to be reposted, I publish my own works for that in my OWN account because this is my job, I don't need anyone to publish my works for me.
Don't do this, I don't take it as a fucking compliment. https://t.co/atlpOeM131"
1435669708523679745,2022-03-19 20:27:50+00:00,1505279903956148231,en,1,0,0,1,1.5039040590104166e+18,,"Wonder have long the GOP fascist &amp; nazi sympathizers at our @TheJusticeDept will let our neighbors &amp; Gov be harassed by these TERRORISTS posing as “concern trolls”?

I’m sorry but are y’all just spineless &amp; pathetic or what?

They LET this right wing terrorism happen over &amp; over https://t.co/kNsX6mXcYk"
1076030792873140224,2022-03-19 14:49:50+00:00,1505194842451705859,en,1,1,0,0,,,"And yet he’s in a Twitter space meant for adults. I’m sorry the kid got harassed but I wouldn’t be sorry after the shit he’s done. 

Screw the fact a white man got sent his bullshit. He’s been doing even after the whole hh bullshit. He hasn’t changed as much as he claims https://t.co/BptGopQrCX"
1439952968468533256,2022-03-19 14:31:32+00:00,1505190236569186305,en,1,1,0,0,1.5051212142007542e+18,,I'm sorry that someone said people shouldn't be harassed because of people insecurities https://t.co/r7qMVT6OWT
27283514,2022-03-18 23:30:39+00:00,1504963523138498562,en,11,0,3,0,1.50496237876446e+18,,"Thanks, I am sorry to hear he has been harassed and felt afraid to post in his own name. That is unacceptable. Any United fan should not be afraid to speak in their own name. Happy to talk directly to him in person https://t.co/0mGHIBYS6P"
17037608,2022-03-18 20:39:09+00:00,1504920363204939776,en,0,0,0,0,,,"I am so sorry that you're getting harassed by the mindless anti-maskers. I fully support you continuing to ask customers to mask up. In fact, that makes me feel safer, as I imagine it does for many other people. Will order books from your shop from now on. https://t.co/O6zW5nrLfG"
1392276165482713090,2022-03-18 10:43:51+00:00,1504770550153031698,en,0,0,0,0,,,"She didn’t actually get stabbed but she does get death threats, hateful DMs &amp; comments, stalked, &amp; harassed every single day. I really feel so sorry for her. 😕 https://t.co/SMW9H0w2HN"
3301232609,2022-03-18 03:40:12+00:00,1504663937416982531,en,2,0,2,1,,,"While I do think some parts of this that were written could have been phrased a little differently, I am definitely not gonna ignore the fact that what the fandom did is unacceptable and I’m really sorry you had to be harassed and doxxed over this queer. https://t.co/Up0AgW8VQX"
1226532685230690314,2022-03-17 20:44:43+00:00,1504559376484352019,en,1,0,0,0,,,????? what is this woman's fault literally for her to be treated and harassed in such a way like these people are actually literal freaks and i feel so sorry for that person to be going through all of this for so long. https://t.co/4pW1pdrGme
399197916,2022-03-17 12:38:56+00:00,1504437126141661186,en,29,0,2,6,,,"I'm very sorry you were harassed but yeah, I've encountered MANY Sephiroth Self Insert Shippers that were VERY hostile to SC shippers for no reason.

It's very fucking weird.

Like its okay to self-ship but you cross the line when you decide to start harassing people. Chill. https://t.co/Dydyhaa1j8"
1478050408614477828,2022-03-17 08:05:44+00:00,1504368371890114561,en,0,0,2,0,1.5043246412167373e+18,1.504261339140735e+18,"@ZenTheOtt @DumbassYoki @FoxGoFloofy @dont_jinxit I'm trying to figure out when they harassed them, sorry if I'm being rude.

https://t.co/TBSd8TsJjn"
165629279,2022-03-17 04:38:24+00:00,1504316195377451008,en,2,0,3,1,1.5039325581444178e+18,,Whew…the part about this being an example for women everywhere.  It’s hard to feel sorry for kim but I still sympathize with her situation because she is being harassed by an unstable person. I have no idea what it’ll take for the world to see kanye for the clown he is today. https://t.co/x7Glke7cwW
717971029054763008,2022-03-17 02:05:13+00:00,1504277644384215049,en,7,0,0,0,1.503885141466239e+18,,Mrs. kim (neighbor)regularly takes my packages &amp; hides them near my shed. I recently got cameras in &amp; saw a THIEF. I called my detective like I’m supposed too since I’ve been getting harassed &amp; they went door to door….anywho.I’m sorry I called u a old hag Mrs. Kim. Cute haircut! https://t.co/GYgvtJsOXE
600941942,2022-03-16 14:39:34+00:00,1504105096484999169,en,0,0,1,0,1.5039325581444178e+18,,"Thank you Trevor for sharing this, and I’m so so sorry your mother went through that tough time in her life. No woman deserves to be harassed by anyone just simply because she wants to be happier. We need to do a lot better as a society. https://t.co/E4sx2kGh7q"
1465707063321841664,2022-03-15 19:10:50+00:00,1503810973680996356,en,3,0,1,0,1.5038052465772134e+18,,"Everyone pls read this!
Also ive msg for those who abused and harassed her in mentions/dms hear me out:
LEAVE MY GIRL ALONE, AND HAVE A LIFE FGS.
FUCKING IDIOTS DON'T EVER TRY TO MESS WITH HER AGAIN.
shaira ily &lt;3
Sorry i had no idea what happened ystrdy. https://t.co/9LEQQyTlgu"
1111105007615688704,2022-03-15 14:25:08+00:00,1503739077224509443,en,1,0,1,0,,,"I'm sorry you're getting harassed, it's honestly ridiculous.
They seem to be acting like children from what I can see, so I recommend blocking them. https://t.co/iTY0gR4PnK"
879701615636303872,2022-03-15 08:27:28+00:00,1503649065321512962,en,30,0,0,15,1.5036128782382408e+18,,"you was raised in an era where women were blamed for being raped because of the way they dressed, it’s indoctrinated in you, I feel sorry for you really..y’all the type to blame your daughters if they ever got sexually harassed https://t.co/S97lSX4hXd"
463294188,2022-03-14 16:49:24+00:00,1503412993241067527,en,0,0,0,0,,,@DrAGrace_cyhtt I'm really sorry you're being harassed. You may want to consider locking your account. That way people can only follow you with your permission. https://t.co/sJeOhHFOUZ
1344806869831987201,2022-03-14 11:49:30+00:00,1503337522260230150,en,2,0,2,0,1.5030750671728517e+18,,"Sorry everyone, I didn’t actually do a PhD, the troll reviewer says so 🙄

Surely if you’re so concerned with spelling and grammar, if it didn’t fit you’d just pick a different name? 

I’ve never harassed anyone in this fandom. Please move on. https://t.co/5ocszAPTcG https://t.co/EgcOkY4eyQ"
968735353870913536,2022-03-14 03:55:43+00:00,1503218290067484675,en,1,0,0,0,1.5032076567475323e+18,,"What the hell, so sorry. But I get harassed online &amp; getting a dickpick on my Reddit dms mostly from horny Indian men🙁

Why;( https://t.co/kIdnHOMTuu"
1459100845174235136,2022-03-13 23:49:31+00:00,1503156334010957824,en,1,0,0,0,1.5031344610675507e+18,,I watched for about 5 sec my girl getting harassed by 3 men who thought it was their right to do so just cos she was standing waiting for me. 2 sec taken up not believing what I was seeing. The rest secs taken to beat the shit outta all 3. Sorry you had to go through this crap✌🏿 https://t.co/uWeuEV5swx
846341251389673472,2022-03-13 21:45:16+00:00,1503125064123928577,en,0,0,0,0,1.50249255769523e+18,,"I'm so sorry you have been harassed. This is a period in history where people have latched on to lies. We rarely read anything truthful about someone whom we know, is unfit for office WNC deserves better. Thank you. Bless you. https://t.co/7RnHVcDqw9"
159736503,2022-03-13 19:33:13+00:00,1503091832174964739,en,2,0,0,0,1.5023893649527644e+18,,I tweeted this a day before intl p1eces we’re getting harassed 😭 sorry y’all https://t.co/rfz97hXRvw
915716050859155456,2022-03-13 17:27:49+00:00,1503060276114956290,en,0,0,0,0,,,Sheeeesh he’s down bad smh I’m sorry you got harassed like this come on MEN do better https://t.co/Vb6demFYJN
1135496208808419328,2022-03-12 22:58:26+00:00,1502781089626361856,en,0,0,0,0,1.502668997006807e+18,1.5027710034070979e+18,"@RWApodcast Sorry about this.
But I think it's terrible if Rusian army are held hostage by the military like them.. it's better to be tortured than harassed 😂

https://t.co/95DZYZcNeJ"
1276525375431065602,2022-03-12 21:21:00+00:00,1502756566885412870,en,0,0,0,0,,,Oh my gosh! I'm so sorry you're being harassed! Have you tried zero human interaction? Wtf. https://t.co/iJgAgWEeGk
50547284,2022-03-12 17:03:12+00:00,1502691692717117440,en,2,0,0,0,1.5020109026687345e+18,1.5026892664674877e+18,"@jeankiernan @francieRD I’m so sorry—thank you for not being silent.

Grifters don’t like being exposed. They make the world a worse place and it’s obvious to everyone except themselves.

I can relate somewhat differently insofar as I’m regularly harassed by misinformation menaces. Here’s an example: https://t.co/wpLmemAO1q"
3001644910,2022-03-12 15:22:41+00:00,1502666395141779457,en,0,0,0,0,,,"I am so very sorry for your loss ! Didn’t know until now . Tragic . I have a genetic clotting factor and have written drs note not to take this vaccine. I have been healthy but harassed for nearly 2 yrs . Even closest friends . But I’m here ❤️.
You are a blessing to your brother https://t.co/4VuT8oNGqs"
1366993963111096323,2022-03-12 00:09:51+00:00,1502436674592198667,en,7,1,0,1,1.5024293664118415e+18,,"/  sorry i got your age wrong. but is that the point ?? you or someone you’re close with still harassed my friend in dms and made up lies about them. keep making fun of me though, it’s really entertaining ❤️ https://t.co/lWgByPYEgu"
2229071948,2022-03-11 16:42:23+00:00,1502324062646849538,en,2,0,0,0,,,I'm sorry to the other people being harassed by supposed allies in the antifascist community. You'll only see their brand lurking on here and peeking through blinds watching everyone else do the hard stuff. https://t.co/BNo0U9g612
185418654,2022-03-11 10:55:04+00:00,1502236661136068608,en,5,0,1,0,1.5022293240236032e+18,,"I harassed this man in the car park at the Kingston Woolies when he was just trying to put away his groceries. For that, I’m sorry. Amazing game tonight. https://t.co/gnajhFv85i"
196059131,2022-03-10 23:50:59+00:00,1502069538652930058,en,1,0,0,0,1.5020678951106191e+18,,I don't think you need to answer for what Russia is doing. I am sorry if anybody harassed you about this because it has nothing to do with you. But thank you for explaining this nonetheless. ❤️ https://t.co/A4HhITQARL
50547284,2022-03-10 19:57:59+00:00,1502010902668734467,en,6,1,1,0,1.4165936878537318e+18,1.501991397183955e+18,"@Rosewind2007 @Jenny_Pewsey I'm so sorry--what an awful experience.

My profession allows me to help people who have abused/harassed others, as well as been victims. So much deep pain on both sides.

Btw, my harasser, too, has been at it for years, and I'm not the only target. 
https://t.co/Um5dPlXvIv"
1192391139426476033,2022-03-10 01:09:35+00:00,1501726930646843400,en,0,0,0,0,1.501546983965737e+18,,As an older TUA fan and Robert Sheehan fan too I find the behaviour of this woman in question totally despicable. I am sorry you were harassed by this individual. I hope this person realises the harm they have caused and look inwards and reflect on their behaviour. https://t.co/bxS3KA40co
911340066651250688,2022-03-08 22:31:42+00:00,1501324810969759746,en,7,0,2,2,1.501313730084225e+18,,"I mean, I was legitimately harassed on here by people for saying that Rodgers/Wilson/Watson would never come here. Granted it wasn’t media members but it was people defending them. I stand by what I said, although I said nerds, not losers. Sorry for being realistic. https://t.co/gc5VHWZ6bl"
1214019944532213762,2022-03-08 22:02:42+00:00,1501317510850826251,en,2,0,0,0,1.50130025732966e+18,,"This bothers me badd, so sorry this happened :( this why sometimes I hate to admit it but I get shy about my fits and it’s not fair bc it’s literally not my confidence. I just don’t wanna be targeted or harassed like this smh, crazier bc she made it something for no reason https://t.co/6ZPz85AwJR"
867761155808395266,2022-03-08 19:01:18+00:00,1501271862214422535,en,1,0,1,0,1.499775158281638e+18,1.501265899189248e+18,"@SertifiedUkr This happened to you?..I'm sorry about this..but this person is really REALLY sooo bad..they even harassed my moot so badly and they just don't apologize about anything..they refuse it..I made a mini thread about it few days ago 
https://t.co/IGOEJmRBSd"
1394261461216776193,2022-03-08 18:00:35+00:00,1501256581702291458,en,0,0,0,0,1.501252568739029e+18,,// the fact that they came into your dms and harassed you and were blatantly racist… i am so fucking sorry that this has happened to you. i am disgusted. https://t.co/cjLAfxItfp
820076904388575234,2022-03-08 13:14:51+00:00,1501184672813965318,en,0,0,0,0,1.5010640107240858e+18,,Wow I am so sorry for them. The family shouldnt be harassed wtf is wrong with ppl. It's just  a sport https://t.co/sdPBCwicLR
292513922,2022-03-08 06:00:07+00:00,1501075269142073347,en,3,0,0,1,1.501008586020987e+18,,"This thread is full of great ideas. If you see someone being harassed, politely inserting yourself into the convo not to say ""are you okay"" but to say ""hey I'm sorry to interrupt but…do I know you from somewhere"" can be a good way to give someone an out and deescalate. https://t.co/QXApxRNTuo"
995018486534451200,2022-03-07 19:53:54+00:00,1500922711383494659,en,9,0,2,0,1.3393736631084278e+18,,"I actually quite dislike HeavyMedic for quite a few personal reasons (namely being the fact that I was relentlessly harassed and targeted a while back for not caring much for it in the first place) so now whenever I see art of it it makes me incredibly depressed-

I’m sorry. . . https://t.co/vgRm7g7tsx"
1382438095132430342,2022-03-07 16:10:50+00:00,1500866574084984840,en,0,0,0,0,,,"Quick question: who exactly is ""harassing"" Jodie Whittaker and Chibnall? As far as I know, neither of them have Twitter accounts. Neither of them have claimed to be harassed. Unless you think criticising them in public qualifies as harassment? Because I'm sorry to say it doesn't. https://t.co/mh3kVKfUsz"
117367021,2022-03-07 15:46:47+00:00,1500860521377054729,en,0,0,0,0,1.5008390333285212e+18,,"Sad state of affairs. Bodabodas need to be regulated, a ticking bomb. I’m sorry Maryann and to the lady harassed  today by animals in human skin. https://t.co/V89sVOW3hH"
1362977061011341316,2022-03-05 22:53:50+00:00,1500243216255176706,en,2,0,1,0,1.500169453610455e+18,,"i feel so bad bc everyone who tried to defend me and everyone else involved in this tw, has been harassed by this person. this was not my intention whatsoever and i'm truly sorry there's disrespectful ppl in this app https://t.co/idQtOR0bCb"
797558868708589572,2022-03-03 18:29:45+00:00,1499451980724457481,en,0,0,0,0,,,"Sorry I sexually harassed miss wojak by saying ""do it jiggle"" as a joke Jesus Christ people need to get off their screens https://t.co/1G88ejGwFS"
951101776760942592,2022-03-03 17:28:42+00:00,1499436618167767040,en,0,0,0,0,1.498354641972736e+18,1.4983787575514112e+18,@SwansonElise @Rafale_W @AmanSahein @usama_toheed I was off Twitter for a few days and looks like someone harassed you on here. Sorry for starting this. I can see that you're being reasonable from your very first reply. https://t.co/b3GwvjqFfh
1269059991312510977,2022-03-02 23:44:19+00:00,1499168756475604998,en,7,0,1,0,,,I am sorry this happened to you and your mutuals but Lily was being harassed over a fictional ship and she was sent death threats so please do not try to downplay that. https://t.co/t4SseLx9sM
337260957,2022-03-02 20:52:22+00:00,1499125483283181569,en,0,0,0,0,1.4990931541375836e+18,,"Throwing a hissy fit smdh those kids have more maturity in their pinky toes than this sorry excuse… as a parent, I would be fuming that the highest ranking office harassed my child, on television, no less… @NikkiFried please unseat this embarrassment https://t.co/ziwD3IinxJ"
1497236257977610241,2022-03-02 15:31:30+00:00,1499044735142535172,en,1,0,0,0,1.4990435949503488e+18,,"//I only feel sorry for the students who are deliberately given bad marks by the other teachers because they don't like them.
There was also a teacher who sexually harassed a student. Of course, not all teachers are bad, but once you become one, you are disappointed how many are. https://t.co/JwlG7C5GZV"
446024864,2022-03-02 10:34:35+00:00,1498970013109309440,en,0,0,0,0,1.4987111695567954e+18,,"Love and light Thoba, I didn't know that being a woman is also a crime in Swaziland, I feel you were the one being sexually harassed, and I am very sorry for all you went through https://t.co/JSAdP7LLQw"
753129963574923264,2022-03-02 03:35:58+00:00,1498864664427573248,en,1,0,3,0,1.4987121592153047e+18,,"Those officers at the city post are really problematic, I got harassed by 2 women officers for wearing a dress with a thigh high slit. 

I'm so sorry sis. 💕 https://t.co/zB1DWmtBd3"
1325439362763513867,2022-03-02 01:19:58+00:00,1498830441780068352,en,0,0,0,0,1.4986147359353528e+18,,"While it sucks that their feelings were hurt by all this, I can't see what there is to be upset about. They weren't being bullied. They weren't being harassed. Guy was a tad goofy but beyond that...not really. Probably shoulda only said ""Sorry, you don't meet the criteria,"" tho. https://t.co/fYCTGJIYv3"
31398123,2022-03-01 02:19:48+00:00,1498483110186520576,en,0,0,0,0,1.498481961836462e+18,,I’m sorry but F*CK THAT!!! How does that give the young man that she wrongfully harassed and assaulted any faith whatsoever in the justice system??? https://t.co/l7HqHZl358
246531663,2022-02-28 15:10:15+00:00,1498314611665289218,en,7,0,0,1,1.4982967108079288e+18,,I saw the interview live @BBCBreakfast aired this morning. I had an impression that the British journalist (sorry I can’t remember her name) tried to confirm that Polish helped him and that was said. However the headline is misleading. Nobody harassed anybody on the border 🇵🇱❤️🇺🇦 https://t.co/FdVkGXAWbd
1474668607174897664,2022-02-27 14:53:59+00:00,1497948129102286849,en,0,0,2,0,1.4979448002928968e+18,,"I'm sorry but.. 
I was r4p3d at the age 10 'till 11, everyday at school (7th-now) i always got sexually harassed.. 
I saw ""someone"" who keeps stalking me and really obsessed w me..
My 20 Y.O cousin did.. Something really bad towards me and I'm still scared 'till now :) https://t.co/ME0n3MRiJn"
1389580223486832641,2022-02-24 00:31:24+00:00,1496643890253860867,en,507,4,9,31,1.4966402491366564e+18,,I’m sorry but the chances of twitter fanyus being the insta fanyus that harassed Javi are like kinda small https://t.co/ouSyFKU5Ys
140564601,2022-02-23 06:13:52+00:00,1496367687471140865,en,1,0,0,0,1.4959976821622784e+18,,"That's so fucked up smh, I am so so sorry that you keep getting harassed by him *gives you a big ol bear HUG* 🤗🤗🐻🐻❤️❤️ you don't deserve this whatsoever. This mofo is a Incel straight up and he deserves to be sent to the Shadow Realm like PRONTO! with his creepy ass 💯😝😠 https://t.co/c2laXRw8WT"
1009856138064683008,2022-02-21 21:59:47+00:00,1495880957794074631,en,0,0,1,0,1.4952844969875333e+18,,I feel really sorry to the person in the screenshot for being harassed over a literal joke https://t.co/uUP9l5tzJh
1358239454943711232,2022-02-21 00:25:54+00:00,1495555342654226433,en,1,0,0,1,1.4955540350841078e+18,,"Dear #Ethiopians, sorry I can't join you at your party today or tomorrow.  My first priority is to provide comfort for women, children, and the elderly #Afar people who have been harassed, terrorized, and killed by the #TPLFisaTerroristGroup . https://t.co/q7MkXOl2cg"
743247107772022784,2022-02-20 18:58:14+00:00,1495472881979072512,en,2,0,0,0,,,"Men getting sexually assaulted/harassed as a joke. Like I’m sorry??? No??? 

Bonus points if it’s a subversion because they thought they were gonna get an attractive partner and they turn out to be: a man/a fat woman/a buff woman/ old woman/don’t meet the beauty standard/ https://t.co/ETavovZaMA"
760390871128870912,2022-02-20 18:49:36+00:00,1495470711535714308,en,4,0,1,4,1.4954526082402345e+18,,I’m sorry you were harassed. https://t.co/GZ9sd5A5DA
1381647322573123585,2022-02-20 17:17:17+00:00,1495447476660228100,en,3,0,0,0,,,and vep sexually harassed (assaulted? im sorry not even i remember the details) someone so thats also awful https://t.co/eoWQGvICEa
17670427,2022-02-20 16:10:51+00:00,1495430761284919298,en,1,0,1,0,1.4952551499835064e+18,,"Hard to watch, but thank you for posting. I'm sorry this happened and glad you and all the other journalists who were harassed are OK. Appreciate your work. https://t.co/7RkEHuHUGi"
823280455302713346,2022-02-20 11:53:37+00:00,1495366026380423168,en,0,0,0,0,1.4951468916460134e+18,,THIS 👇 is such ignorant behavior from the “freedom” lovers. It’s the freedom to be a stupid 8 year old. I’m so sorry you and your crew were harassed by these goons. https://t.co/H73YQLbxiq
862561821667975169,2022-02-20 08:44:35+00:00,1495318451929427971,en,0,0,0,0,1.4951347456714875e+18,,When i was leaving Nigeria then my mum made me hide all the dollars inside my body and truly i was harassed till i got to my gate. Once you are a child/student they aim at you. So sorry for your child’s experience 😢 https://t.co/K1AATyQiFd
391167104,2022-02-20 02:48:02+00:00,1495228724626837504,en,3,0,1,1,1.4952180923975025e+18,,"Sorry, Fox! AOC can't fly economy because if she did she would be harassed by the far-right members on the plane, and possibly assaulted! I wonder who made this situation so volatile? https://t.co/eezxUKiWLn"
26509044,2022-02-20 01:07:22+00:00,1495203389231312898,en,25,1,3,5,1.4951588933490074e+18,,"I am so disgusted and angry with a burning in my heart. What country is this? Who are those people waving our flag? I’m so sorry @KamilKaramali &amp;  @glen_mcgregor &amp; @EvanLSolomon &amp; EVERY JOURNALIST who’s been harassed by these ignorant, misguided beings. 

THIS CANNOT BE TOLERATED https://t.co/cUFy8yITeO"
266947054,2022-02-20 00:14:21+00:00,1495190049352208387,en,5,0,1,1,1.4951549328690586e+18,,I'd charge them with harassment under Canadian Human Rights Act.@glen_mcgregor @CTVNews Sorry to see the harassment &amp; bullying towards you while at work. I was bullied &amp; harassed at my last work place &amp; it feels awful. I reported it &amp; they were both found guilty.#OccupationOttawa https://t.co/lFJj0cpPpU
1261652454845952000,2022-02-19 23:43:31+00:00,1495182289801822213,en,4,0,1,0,,,"Im sorry that that a bunch of people geninuely like harassed the shit out of him, but like,

 I just cannot seem to accept the fact that the song was actually serious.

Not to mention he starts off the post with ""Oh newgrounds my love, I know I can always rely on you."" https://t.co/G2cgzHtqKT"
1485984292421386241,2022-02-19 11:19:12+00:00,1494994976102658050,en,0,0,0,0,1.4949942005254308e+18,,Saying that. Louise why'd u run? There were 2 of u it was just me lol 😆 😂  (423)400-2720 ...oops! I'm sorry I didn't mean 2 type ur number...I sure hope u don't get harassed by bored people....hope they don't *67 their number.... I told u before u pulled over u got the right 1. https://t.co/nIHHQSK9QV
1365401692372692998,2022-02-19 01:02:26+00:00,1494839761902649344,en,0,0,1,0,,,"I'm sorry but imagine thinking being sexually harassed is preferable to your brother seeing your body. There is nothing Inherently sexual about either genders' chest. If your brother would get turned on by your tits, hes the weirdo. https://t.co/7fTAHUD88f"
